ID	LABEL	Parent	IAO:0000115	IAO:0000119	IAO:0000117	IAO:0000118	obo:T4FS_0000564	obo:T4FS_0000565	oboInOwl:created_by	oboInOwl:creation_date	rdfs:comment	owl:deprecated	obo:IAO_0000233
obo:T4FS_0000535	encoding schema	data stewardship technical concept	Machine processable specifications which define the structure and syntax of metadata specifications in a formal schema language.	CASRAI. https://casrai.org/term/encoding-schema/	https://orcid.org/0000-0002-7702-4495|Peter McQuilton						AL 5.12.22 Moved from 'findability of digital assets' as it is definitely not a particular data stewardship guideline.		
obo:T4FS_0000390	engage innovation partners	engaging in open innovation beyond academia	Learn about innovation partners' interests and concerns, analyze them and position the project work/outcome properly. Reach out to innovation partners with proactive and pragmatic innovation plan which is in compliance with FAIR principles.		Celia van Gelder|Mateusz Kuzak|Yan Wang								
obo:T4FS_0000084	engaging in open innovation beyond academia	publish data											
BFO:0000001	entity												
obo:T4FS_0000042	ethical application of patents, licenses	publish data											
obo:T4FS_0000225	evaluation	assessment	Evaluation is a decision about significance, value, or quality of something, based on careful study of its good and bad features.	CASRAI. https://casrai.org/term/evaluation/	https://orcid.org/0000-0002-7702-4495|Peter McQuilton						AL 17.3.22: We may wish to make this an alternative term of Assessment.		
obo:T4FS_0000580	evaluation indicator	information content entity	Evaluation indicators are designed to enable the measurement of the degree of compliance against a guideline using a set of criteria. The goals of such indicators are varied, but a good example would be to improve the re-usability of the digital asset being measured for increased discoverability, interoperability and overall machine actionability.	Definition by https://orcid.org/0000-0002-7702-4495 and drawn in part from https://fairplus.github.io/Data-Maturity/docs/Indicators									https://github.com/terms4fairskills/FAIRterminology/issues/22
obo:T4FS_0000315	evaluation of how to publish your data	exposing data	To be able to define and deploy appropriate criteria, based on the FAIR principles, to identify the appropriate publishing platform for a dataset. This may, for example, involve discovering the mark-up of the platform, the exchange formats and data models used, and the licensing information for each repository. Tools such as the FAIR evaluator or FAIRshake may be used to assess the FAIRnessbased on human-entered questionnaires or FAIRsharing resource metadata.	[PMQ]	Peter McQuilton								
obo:T4FS_0000021	exposing data	('competency gained through' some ('learning medium' and ('supports implementation of' some 'fair principle')))|data stewardship activity	Exposing data is the activity of exposing your data to collaborators, the public, or other interested parties. A data producer makes the data accessible to external users in a machine- and/or human-readable way.	[PMQ 3.2022, AL 15.3.22]	https://orcid.org/0000-0002-7702-4495|Peter McQuilton						AL 15.3.22: Was "expose your data", which was not in the style of other term labels. Also updated definition, but might need revisiting later for a more formal definition.		
obo:T4FS_0000350	extensible markup language	'contributes to the implementation of' some 'I1. (meta)data use a formal, accessible, shared, and broadly applicable language for knowledge representation'|data stewardship technical concept	Extensible Markup Language (XML) is a simple, very flexible text format derived from SGML (ISO 8879). Originally designed to meet the challenges of large-scale electronic publishing, XML is also playing an increasingly important role in the exchange of a wide variety of data on the Web and elsewhere.	CASRAI. https://casrai.org/term/extensible-markup-language/	https://orcid.org/0000-0002-7702-4495|Peter McQuilton	XML							
obo:T4FS_0000460	extensible resource identifier	'contributes to the implementation of' some 'F1. (meta)data are assigned a globally unique and persistent identifier'|identifier	A defining scheme used for identification of resources (including people and organizations) and the sharing of data across domains, enterprises, and applications. XRI TC will define a Uniform Resource Identifier (URI) scheme and a corresponding Uniform Resource (URN) namespace.n/aCASRAI. https://www.oasis-open.org/committees/tc_home.php?wg_abbrev=xri	CASRAI. https://casrai.org/term/extensible-resource-identifier/	Peter McQuilton								
obo:T4FS_0000512	F1. (meta)data are assigned a globally unique and persistent identifier	findability of digital assets			Peter McQuilton								
obo:T4FS_0000199	F2. data are described with rich metadata	findability of digital assets			Peter McQuilton								
obo:T4FS_0000435	F3. metadata clearly and explicitly include the identifier of the data they describe	findability of digital assets			Peter McQuilton								
obo:T4FS_0000393	F4. (meta)data are registered or indexed in a searchable resource	findability of digital assets			Peter McQuilton								
obo:T4FS_0000579	fair cookbook recipe	online documentation	The FAIR Cookbookâ€™s recipes are a combination of guidance, technical, hands-on, background and review types to cover the operation steps of FAIR data management, and are classified according to the audience types, to serve all those involved in the data management life cycle. The FAIR Cookbook is for anyone working in the Life Sciences who needs guidance on applying the FAIR Principles in practice.	https://faircookbook.elixir-europe.org/content/recipes/introduction/FAIR-cookbook-audience.html	https://orcid.org/0000-0002-7702-4495								
obo:T4FS_0000175	fair evaluation of repositories for data deposition	exposing data	To be able to define and deploy appropriate criteria, based on the FAIR principles, to identify the appropriate repository for a dataset. This may, for example, involve discovering the mark-up of the repository, the exchange formats and data models used, and the licensing information for each repository. Tools such as the FAIR evaluator or FAIRshake may be used to assess the FAIRness of a repository based on human-entered questionnaires or FAIRsharing resource metadata.	[PMQ]	Peter McQuilton	FAIR data submission|Repository FAIRness							
obo:T4FS_0000457	fair mentoring	('competency gained through' some ('learning medium' and ('supports implementation of' some 'fair principle')))|fair training	The act of mentoring around FAIR data stewardship.	PMQ	https://orcid.org/0000-0002-7702-4495|Peter McQuilton|Philippe Rocca-Serra|Susanna Sansone								
obo:T4FS_0000031	fair metrics selection skills	fairness assessment	Ability to select the appropriate FAIR metrics among the existing ones in relation to the type of digital object concerned.		Kristina Hettne|Victoria Dominguez Del Angel|Yann Le Franc								
obo:T4FS_0000447	fair principle	data stewardship guideline	The FAIR principles are guidelines to improve the Findability, Accessibility, Interoperability, and Reuse of digital assets. The principles emphasise machine-actionability (i.e., the capacity of computational systems to find, access, interoperate, and reuse data with none or minimal human intervention) because humans increasingly rely on computational support to deal with data as a result of the increase in volume, complexity, and creation speed of data. The principles refer to three types of entities: data (or any digital object), metadata (information about that digital object), and infrastructure.	https://www.go-fair.org/fair-principles/	Peter McQuilton				Peter McQuilton	2020-10-02T14:56:15.031154Z			
obo:T4FS_0000029	fair stewardship supervising	fair training	The activity of supervision of other people to ensure FAIR data practices.	PMQ	https://orcid.org/0000-0002-7702-4495|Peter McQuilton|Philippe Rocca-Serra|Susanna Sansone								
obo:T4FS_0000162	fair stewardship training	fair training	The provision of training materials and events in and around good data stewardship.	PMQ	https://orcid.org/0000-0002-7702-4495|Peter McQuilton|Philippe Rocca-Serra|Susanna Sansone								
obo:T4FS_0000259	fair training	('competency gained through' some ('learning medium' and ('supports implementation of' some 'fair principle')))|data stewardship activity	Activities in and around the provision of training, mentorship and teaching opportunities for good data management and the implementation of FAIR practices.	PMQ	https://orcid.org/0000-0002-7702-4495|Peter McQuilton|Philippe Rocca-Serra|Susanna Sansone								
obo:T4FS_0000252	fairness assessment	('competency gained through' some ('learning medium' and ('supports implementation of' some 'fair principle')))|assessment	Ability to apply knowledge about FAIR metrics and assessing FAIRness using FAIR assessment tools.		Kristina Hettne|Victoria Dominguez Del Angel|Yann Le Franc								
obo:T4FS_0000583	fairplus dataset maturity model indicator	evaluation indicator	The fairplus dataset maturity model indicators are used within the context of the model, which is intended as a comprehensive reference model for state-of-FAIRness improvement in research datasets. Based on the FAIR guiding principles, the DSM model defines and classifies requirements that constitute an incremental path towards improving FAIRness level for a given research dataset.	https://fairplus.github.io/Data-Maturity/	https://orcid.org/0000-0002-7702-4495	fairplus DSM model indicator							
obo:T4FS_0000584	fairplus DSM content-related indicator	fairplus dataset maturity model indicator	The fairplus DSM content-related indicators relate to what is reported in the Dataset (data) & the Dataset Descriptor (metadata).	https://fairplus.github.io/Data-Maturity/	https://orcid.org/0000-0002-7702-4495								
obo:T4FS_0000586	fairplus DSM hosting-environment capabilities indicator	fairplus dataset maturity model indicator	The fairplus DSM hosting-environment capabilities indicator relate to the capabilities of the hosting environment that enables and supports the use of FAIR data	https://fairplus.github.io/Data-Maturity/	https://orcid.org/0000-0002-7702-4495								
obo:T4FS_0000585	fairplus DSM representation and format indicator	fairplus dataset maturity model indicator	The fairplus DSM representation and format indicators relate to how the data object & metadata object are represented and formatted.	https://fairplus.github.io/Data-Maturity/	https://orcid.org/0000-0002-7702-4495						AL 5.12.22: Please note that the 'and' in this label is a direct representation of the fairplus DSM model, and not a ontological design choice.		
obo:T4FS_0000248	findability of digital assets	fair principle			Peter McQuilton								
obo:T4FS_0000293	flexibility in relating fair criteria to openness	fair training	Appreciate the need for flexibility in applying FAIR criteria to make data as open as possible, as closed as necessary.		Angus Whyte								
obo:T4FS_0000214	format and media migration	archiving			Kristina Hettne|Victoria Dominguez Del Angel|Yann Le Franc								
obo:T4FS_0000140	foundational interoperability	'contributes to the implementation of' some 'interoperability of digital assets'|interoperability	Foundational interoperability allows data exchange from one information technology system to be received by another and does not require the ability for the receiving information technology system to interpret the data.REFERENCE. Healthcare information management and systems society	CASRAI. https://casrai.org/term/foundational-interoperability/	Peter McQuilton								
obo:T4FS_0000426	funding acquisition management	resource management	The consideration of available monetary resources for a specific time period to serve a specific purpose.	KH	Kristina Hettne|Simon Hodson|Victoria Dominguez Del Angel								
obo:T4FS_0000532	github repository	learning medium			Peter McQuilton				Peter McQuilton	2020-10-01T21:03:55.425579Z			
obo:T4FS_0000505	golden record	data stewardship technical concept	1. A single, well-defined version of all the data entities in an organizational ecosystem. In this context, a golden record is sometimes called the single version of the truth, where truth is understood to mean the reference to which data users can turn when they want to ensure that they have the correct version of a piece of information. The golden record encompasses all the data in every system of record within a particular organization. A system of record is an information storage and retrieval system that serves as the authoritative source for a particular data element in a system containing multiple sources of the same element. To ensure data integrity, a single system of record must always exist for each and every data element. A well-maintained, current golden record should be a fundamental element of the Master Data Management policy for every enterprise. 2. The word â€œgoldenâ€ is sometimes used in information technology to express the importance of some type of source. In the context of virtualization, for example, a golden image is a template for a virtual machine, virtual desktop, servers, or hard disk drive.	CASRAI. https://casrai.org/term/golden-record/	https://orcid.org/0000-0002-7702-4495|Peter McQuilton								
obo:T4FS_0000472	governance	data stewardship activity	1. Exercising authority to provide direction and to undertake, coordinate, and regulate activities in support of achieving this direction and desired outcomes. Governance can be thought of as the role of an organization's board of directors or its equivalent that is focused on defining that organization's purpose and the development of the strategies, objectives, values, and policies that frame how that purpose will be pursued. It includes the development of such things as mission statements, statements of organizational objectives and values, logic models, organizational performance metrics, risk management frameworks, policies and guidelines for financial and operational matters, stakeholder relations, etc.	CASRAI. https://casrai.org/term/governance/	Peter McQuilton								
obo:T4FS_0000282	governance and accountability model	data stewardship technical concept	Provides the relationship and process context for working together to ensure outcomes are achieved.	CASRAI. https://casrai.org/term/governance-and-accountability-model	https://orcid.org/0000-0002-7702-4495|Peter McQuilton								
obo:T4FS_0000308	high performance computing management	resource management	High-performance computing (HPC) is a process for using of super computers and parallel processing techniques for solving complex computational problems. HPC technology focuses on developing parallel processing algorithms and systems by incorporating both administration and parallel computational techniques.	(modified from wikipedia)[VDA]	Kristina Hettne|Simon Hodson|Victoria Dominguez Del Angel	HPC management							
obo:T4FS_0000135	high quality data	data stewardship technical concept	High-quality data are complete, timely, accurate, consistent, relevant, reliable, traceable, cleaned, validated, and well documented.	CASRAI. https://casrai.org/term/high-quality-data/	Peter McQuilton								
obo:T4FS_0000495	how to find fair research data tools/services (catalogues)	('competency gained through' some ('learning medium' and ('supports implementation of' some 'fair principle')))|the use of fair and open research tools or services	Know how to search for and identify FAIR services or tools that fit project needs.		Angus Whyte								
obo:T4FS_0000136	how to make your data reuseable	('competency gained through' some ('learning medium' and ('supports implementation of' some 'reuse of digital assets')))|the use of fair and open research tools or services	Understand what reuse is permitted according to the licenses or terms and conditions applicable to services, tools and their content.		Angus Whyte								
obo:T4FS_0000236	human-readable format	'contributes to the implementation of' some 'I1. (meta)data use a formal, accessible, shared, and broadly applicable language for knowledge representation'|data stewardship technical concept	Data and code that are commented so that humans can understand what it represents, it's design, and purpose.REFERENCE. Wilson G, Aruliah DA, Brown CT, Hong NPC, Davis M, Guy RT, Haddock SHD, Huff K, Mitchell IM, Plumbley MD, Waugh B, White EP, Wilson P (2012). Best practices for scientific computing , arXiv, 29 November, 1-6.	CASRAI. https://casrai.org/term/human-readable-format/	Peter McQuilton								
obo:T4FS_0000137	I1. (meta)data use a formal, accessible, shared, and broadly applicable language for knowledge representation	interoperability of digital assets			Peter McQuilton								
obo:T4FS_0000361	I2. (meta)data use vocabularies that follow fair principles	interoperability of digital assets			Peter McQuilton								
obo:T4FS_0000452	I3. (meta)data include qualified references to other (meta)data	interoperability of digital assets			Peter McQuilton								
obo:T4FS_0000529	identifier	'contributes to the implementation of' some 'F1. (meta)data are assigned a globally unique and persistent identifier'|data stewardship technical concept			Peter McQuilton								
obo:T4FS_0000169	identity management	resource management	Identity Management (IdM), also called Identity and Access Management (IAM) refers to a framework of policies and technologies for ensuring that the proper  user in an organisation has the appropriate access to technology resources  systems fall under the overarching umbrella of IT security.  IdM systems not only identify, but authenticate and authorize individuals  who will be using IT resources, but also the hardware and applications users need to access.	https://en.wikipedia.org/wiki/Identity_management	Kristina Hettne|Leighton Christiansen|Simon Hodson|Victoria Dominguez Del Angel	IAM|IdM|Identity and Access Management							
obo:T4FS_0000462	impact	data stewardship technical concept	In the context of a researcher's activities, impact is the consequence of the research and new knowledge on the advancement of the specialty. Science-based policies, regulations, services and technology transfers are some examples of ways target results can be achieved and impact demonstrated.	CASRAI. https://casrai.org/term/impact/	Peter McQuilton								
obo:T4FS_0000212	implement secure storage	storage security management	Configure secure storage and monitor its usage		Angus Whyte|Celia van Gelder|Mateusz Kuzak|Yan Wang								
obo:T4FS_0000331	information governance	information security	Information governance, is the overall strategy for information at an organization. Information governance balances the risk that information presents with the value that information provides. Information governance helps with legal compliance, operational transparency, and reducing expenditures associated with legal discovery.	https://en.wikipedia.org/wiki/Information_governance, accessed 8.2.22	https://orcid.org/0000-0002-7702-4495|Peter McQuilton						CASRAI is the source for the term, with the definition provided separately.		
obo:T4FS_0000195	information management advisor	role	A person having a broad knowledge of information management disciplines and who provides guidance and support to program and staff functions on all aspects of managing the information resource.	CASRAI. https://casrai.org/term/information-management-advisor/	Peter McQuilton								
obo:T4FS_0000437	information management specialist	role	A person who is expert in one or more of the information management disciplines that support the effective and efficient management of information.	CASRAI. https://casrai.org/term/information-management-specialist/	Peter McQuilton								
obo:T4FS_0000107	information security	data stewardship activity			https://orcid.org/0000-0002-7702-4495	Access management					AL 16.3.22: Changed 'information security and access management' such that access management went in as an alternative term. If required in future, we may wish to separate it out completely.		
obo:T4FS_0000155	information technology specialist	role	Information systems and technology infrastructure manager, expert, or technician.	CASRAI. https://casrai.org/term/information-technology-specialist/	Peter McQuilton								
obo:T4FS_0000307	innovation	data stewardship activity	In the context of a researcher's activities, innovation is the development of modified or novel approaches, theories, concepts, ideas or solutions. Innovation is one of four valued outcomes.	CASRAI. https://casrai.org/term/innovation/	https://orcid.org/0000-0002-7702-4495|Peter McQuilton								
obo:T4FS_0000257	integrated access management	data stewardship activity	A combination of business processes, policies and technologies that allows organizations to provide secure access to confidential data. Integrated access management software is used by enterprises to control the flow of sensitive data in and out of the network.	CASRAI. https://casrai.org/term/integrated-access-management/	https://orcid.org/0000-0002-7702-4495|Peter McQuilton								
obo:T4FS_0000455	integration	data stewardship activity	1. The act of bringing together smaller components into a single system that functions as one. 2. In the context of information technology: The end result of a process that aims to stitch together different, often disparate, subsystems so that the data contained in each becomes part of a larger, more comprehensive system that, ideally, quickly and easily shares data when needed. This often requires that organizations build a customized architecture or structure of applications to combine new or existing hardware, software and other communications.	CASRAI. https://casrai.org/term/integration/	https://orcid.org/0000-0002-7702-4495|Peter McQuilton								
obo:T4FS_0000086	integrity	data stewardship activity	In the context of data and network security: The assurance that information can only be accessed or modified by those authorized to do so. Measures taken to ensure integrity include controlling the physical environment of networked terminals and servers, restricting access to data, and maintaining rigorous authentication practices. Data integrity can also be threatened by environmental hazards, such as heat, dust, and electrical surges.	CASRAI. https://casrai.org/term/integrity/	https://orcid.org/0000-0002-7702-4495|Peter McQuilton								
obo:T4FS_0000306	intellectual leadership	data stewardship soft skill	The capacity to influence stakeholders and the direction of research activities; the ability to shape others' understanding in ways that capture interest, inform and gain support; and, the capacity to influence the actions and opinions of others.	CASRAI. https://casrai.org/term/intellectual-leadership/	https://orcid.org/0000-0002-7702-4495|Peter McQuilton								
obo:T4FS_0000112	interface testing	assessment	Testing conducted to evaluate whether systems or components pass data and control correctly to each other.	CASRAI. https://casrai.org/term/interface-testing/	https://orcid.org/0000-0002-7702-4495|Peter McQuilton								
obo:T4FS_0000189	international chemical identifier	'contributes to the implementation of' some 'F1. (meta)data are assigned a globally unique and persistent identifier'|persistent identifier	In the context of chemistry: The International Chemical Identifier is a non-proprietary identifier for chemical substances that can be used in printed and electronic data sources thus enabling easier linking of diverse data compilations. International Union of Pure and Applied Chemistry (IUPAC)REFERENCE. MIT data management and publishing	CASRAI. https://casrai.org/term/international-chemical-identifier/	Peter McQuilton								
obo:T4FS_0000274	international standard	'contributes to the implementation of' some 'I1. (meta)data use a formal, accessible, shared, and broadly applicable language for knowledge representation'|data stewardship technical concept	A standard that is used in multiple nations and whose development process is open to representatives from all countries.	CASRAI. https://casrai.org/term/international-standard/	Peter McQuilton								
obo:T4FS_0000020	interoperability	'contributes to the implementation of' some 'interoperability of digital assets'|data stewardship technical concept	The capability to communicate, execute programs, or transfer data among various functional units in a useful and meaningful manner that requires the user to have little or no knowledge of the unique characteristics of those units. Foundational, syntactic, and semantic interoperability are the three necessary aspects of interoperability.	CASRAI. https://casrai.org/term/interoperability/	Peter McQuilton								
obo:T4FS_0000014	interoperability of digital assets	fair principle			Peter McQuilton								
obo:T4FS_0000172	investigate open innovation opportunities	engaging in open innovation beyond academia	Explore the potential application domain/sociental implication of the project work and the communities of users/partners.		Celia van Gelder|Mateusz Kuzak|Yan Wang								
obo:T4FS_0000143	knowledge of authorisation management	authorisation management	Bin for types of Knowledge related to Authorization management.		leightonlc								
obo:T4FS_0000289	knowledge of change management	change management	Bin for types of Knowledge related to Change management.		leightonlc								
obo:T4FS_0000526	knowledge of cloud computing environment management	cloud computing environment management	Bin for types of Knowledge related to Cloud computing environment management.		leightonlc								
obo:T4FS_0000228	knowledge of data management costs management	data management costs management	Bin for types of Knowledge needed for Data management costs management.		leightonlc								
