ID	LABEL	Parent	IAO:0000115	IAO:0000119	IAO:0000117	IAO:0000118	obo:T4FS_0000564	obo:T4FS_0000565	oboInOwl:created_by	oboInOwl:creation_date	rdfs:comment	owl:deprecated	obo:IAO_0000233
obo:T4FS_0000096	metadata catalogue	'contributes to the implementation of' some 'F4. (meta)data are registered or indexed in a searchable resource'|data stewardship technical concept	Catalogue containing metadata records that enables services to find data and services.	RDMT. https://terms.codata.org/rdmt/metadata-catalogue	https://orcid.org/0000-0002-7702-4495|https://orcid.org/0000-0003-2687-1982|https://orcid.org/0000-0002-5214-4466				https://orcid.org/0000-0003-2687-1982				
obo:TF4S_0000574	metadata creation	curation	Metadata creation concerns the creation of data that provides information about characteristics, aspects or context of other data entities such as a dataset or other digital or analog object.	AL 22.3.22, and see also FRBR User Tasks at: https://sites.google.com/site/metadatastandards/chapter-6/6-3-frbr-user-tasks.	https://orcid.org/0000-0002-7702-4495								
obo:T4FS_0000327	metadata dataset	'contributes to the implementation of' some 'F4. (meta)data are registered or indexed in a searchable resource'|metadata record	The set of metadata describing a specific dataset.	Definition from now-deprecated CASRAI Glossary term: metadata-dataset	https://orcid.org/0000-0002-7702-4495|https://orcid.org/0000-0003-2687-1982|https://orcid.org/0000-0002-5214-4466								
obo:T4FS_0000160	metadata exposure	('competency gained through' some ('learning medium' and ('supports implementation of' some 'accessibility of digital assets')))|('competency gained through' some ('learning medium' and ('supports implementation of' some 'findability of digital assets')))|('competency gained through' some ('learning medium' and ('supports implementation of' some 'fair principle')))|('competency gained through' some ('learning medium' and ('supports implementation of' some 'interoperability of digital assets')))|('competency gained through' some ('learning medium' and ('supports implementation of' some 'reuse of digital assets')))|exposing data	Metadata exposure is the process of finding, identifying, selecting and acquiring/obtaining access to a metadata entity.	AL 22.3.22, and see also FRBR User Tasks at: https://sites.google.com/site/metadatastandards/chapter-6/6-3-frbr-user-tasks.	https://orcid.org/0000-0002-7702-4495|Nancy Hoebelheinrich						AL 22.3.22: Refactored from 'metadata creation and exposure'. Metadata creation has moved to the Curation hierarchy.		
obo:T4FS_0000517	metadata record	'contributes to the implementation of' some 'F4. (meta)data are registered or indexed in a searchable resource'|metadata catalogue	Set of metadata elements and their values that describe an object. Metadata elements in the record may derive from a metadata profile or standard, and may include different types of metadata (descriptive, administrative, etc.). A metadata record is typically stored within a metadata catalogue or repository.	RDMT. https://terms.codata.org/rdmt/metadata-record	https://orcid.org/0000-0002-7702-4495|https://orcid.org/0000-0003-2687-1982|https://orcid.org/0000-0002-5214-4466								
obo:T4FS_0000300	metadata search via metadata providers	data discovery	To be able to identify and process metadata over the internet, sourced from a variety of metadata providers and schemata.	[PMQ]	https://orcid.org/0000-0003-2687-1982	Metadata processing|Metadata search							
obo:T4FS_0000159	minimal metadata	'contributes to the implementation of' some 'F2. data are described with rich metadata'|metadata	Description of a digital object with a limited number of fields including at least a name and persistent identifier.	RDMT. https://terms.codata.org/rdmt/minimal-metadata	https://orcid.org/0000-0002-7702-4495|https://orcid.org/0000-0002-5214-4466 								
obo:T4FS_0000467	national standard	'contributes to the implementation of' some 'I1. (meta)data use a formal, accessible, shared, and broadly applicable language for knowledge representation'|data stewardship technical concept	From an official perspective, a national standard is adopted by a national standards body (e.g., Standards Council of Canada, American National Standards Institute, British Standards Institution) and made available to the public. Practically speaking, however, a national standard is any standard that is widely used and recognized within a country. In this context, even government standards, such as those issued by the Occupational Safety and Health Administration (OSHA), can be considered national standards.	Definition from now-deprecated CASRAI Glossary term: national-standard	https://orcid.org/0000-0002-7702-4495|https://orcid.org/0000-0003-2687-1982|https://orcid.org/0000-0002-5214-4466								
obo:T4FS_0000258	noisy data	data	Meaningless data, including any data that cannot be understood and interpreted correctly by machines such as unstructured text; any data that has been received, stored, or changed in such a manner that it cannot be read or used by the program that originally created it.	RDMT. https://terms.codata.org/rdmt/noisy-data	https://orcid.org/0000-0002-7702-4495|https://orcid.org/0000-0003-2687-1982|https://orcid.org/0000-0002-5214-4466								
obo:T4FS_0000033	non identifiable data	data	Data that could not lead to the identification of a specific object of interest. These may be data that have been de-identified, or that could not lead to identifiable information in the first place.	Modified by AL on 6.5.22 from CASRAI. https://casrai.org/term/non-identifiable-data/	https://orcid.org/0000-0002-7702-4495|https://orcid.org/0000-0003-2687-1982						AL 6.5.22: Modifed CASRAI definition to distinguish this term from 'non personally identifiable information.' Further work may determine whether or not both terms are required.		
obo:T4FS_0000244	non personally identifiable information	data stewardship technical concept	Data that could not lead to the identification of a specific individual, to distinguishing one person from another, or to personally identifiable information. These may be data that have been de-identified, or that could not lead to personally identifiable information in the first place.	Definition from now-deprecated CASRAI Glossary term: non-personally-identifiable-information	https://orcid.org/0000-0002-7702-4495|https://orcid.org/0000-0003-2687-1982|https://orcid.org/0000-0002-5214-4466								
obo:T4FS_0000224	normalization	data stewardship technical concept	Organising data into tables so that the results of using the database are always unambiguous and as intended. Normalisation is typically a refinement process after the initial exercise of identifying the data objects that should be in the database, identifying their relationships, and defining the tables required and the columns within each table. First normal form (1NF) is the “basic” level of normalisation: Data and information are contained in two-dimensional tables with rows and columns. Each column corresponds to a sub-object or an attribute of the object represented by the entire table. Each row represents a unique instance of that sub-object or attribute and must be different in some way from any other row (that is, no duplicate rows are possible). All entries in any column must be of the same kind. For example, in the column labelled “Date,” only dates are permitted. In Second normal form (2NF), the tables are in first normal form and, in addition, each column in a table that is not a determiner of the contents of another column must itself be a function of the other columns in the table. At the second normal form, modifications are still possible because a change to one row in a table may affect data that refers to this information from another table. In Third normal form (3NF), the tables are in second normal form and, in addition, there is no transitive functional dependency. For example, if A is functionally dependent on B, and B is functionally dependent on C, then C is transitively dependent on A via B. In Domain/key normal form (DKNF), a key uniquely identifies each row in a table. A domain is the set of permissible values for an attribute. By enforcing key and domain restrictions, the database is assured of being freed from modification anomalies. DKNF is the normalisation level that most designers aim to achieve.	RDMT. https://terms.codata.org/rdmt/normalisation	https://orcid.org/0000-0002-7702-4495|https://orcid.org/0000-0003-2687-1982|https://orcid.org/0000-0002-5214-4466								
oboInOwl:ObsoleteClass	Obsolete Class	owl:Thing											
BFO:0000003	occurent												
obo:T4FS_0000095	online documentation	learning medium			https://orcid.org/0000-0003-2687-1982				https://orcid.org/0000-0003-2687-1982	2020-10-01T20:53:59.107153Z			
obo:T4FS_0000082	online workbook	online documentation							https://orcid.org/0000-0003-2687-1982	2020-10-01T20:52:57.551905Z			
obo:TF4S_0000567	ontologist	role			https://orcid.org/0000-0002-7702-4495						AL 15.3.22: Added for FAIR Cookbook integration.		
obo:T4FS_0000193	open access publishing	publish data			https://orcid.org/0000-0002-7702-4495|Celia van Gelder|Mateusz Kuzak|Yan Wang						AL 22.3.22: refactored 'open access publishing and self-archiving' to be two separate concepts ('open access publishing', and 'self-archiving') according to T4FS best practices. Self-archiving did not have to be created because we already had self-archive, which was then moved to the Archiving hierarchy. 'publish open access' was also removed in favour of this term as they were too similar to have without the potential for confusion by users.		
obo:T4FS_0000474	open archives initiative protocol for metadata harvesting	machine access via api	Low-barrier mechanism for repository interoperability. Data Providers are repositories that expose structured metadata via OAI-PMH. Service Providers then make OAI-PMH service requests to harvest that metadata. OAI-PMH is a set of six verbs or services that are invoked within HTTP.	RDMT. https://terms.codata.org/rdmt/open-archives-initiative-protocol-for-metadata-harvesting	https://orcid.org/0000-0003-2687-1982|https://orcid.org/0000-0002-5214-4466								
obo:T4FS_0000264	open data	data	Data that are accessible, machine-readable, usable, intelligible, and freely shared. Open data can be freely used, re-used, built on, and redistributed by anyone – subject only, at most, to the requirement to attribute and sharealike.	RDMT. https://terms.codata.org/rdmt/open-data	https://orcid.org/0000-0002-7702-4495|https://orcid.org/0000-0003-2687-1982|https://orcid.org/0000-0002-5214-4466								
obo:T4FS_0000468	open government	data stewardship technical concept	A governing culture that holds that the public has the right to access the documents and proceedings of government to allow for greater openness, accountability, and engagement.	Definition from now-deprecated CASRAI Glossary term: open-government	https://orcid.org/0000-0002-7702-4495|https://orcid.org/0000-0003-2687-1982|https://orcid.org/0000-0002-5214-4466								
obo:T4FS_0000134	operational management	data stewardship soft skill	Ongoing organizational activities associated with supporting functional elements, as opposed to project elements. Operational management also includes support of products that the organization has created through project activity.	Definition from now-deprecated CASRAI Glossary term: operational-management	https://orcid.org/0000-0002-7702-4495|https://orcid.org/0000-0003-2687-1982|https://orcid.org/0000-0002-5214-4466								
obo:T4FS_0000417	organizational leadership	data stewardship soft skill	Organizational leadership is: (a) The ability to attract, assess, mobilize and focus energies and talent to work towards a shared purpose aligned with the mandate of the organization; (b) The ability to change culture, processes and priorities within the organization; and, (c) The ability to mentor.	Definition from now-deprecated CASRAI Glossary term: organizational-leadership	https://orcid.org/0000-0002-7702-4495|https://orcid.org/0000-0003-2687-1982|https://orcid.org/0000-0002-5214-4466								
obo:T4FS_0000413	original repository	data store	Type of repository where the original copy of data was stored and probably a data identifier registered.	RDMT. https://terms.codata.org/rdmt/original-repository	https://orcid.org/0000-0002-7702-4495|https://orcid.org/0000-0003-2687-1982|https://orcid.org/0000-0002-5214-4466								
obo:T4FS_0000286	patent application	ethical application of patents, licenses	Choose the proper type of patent for the project data and apply for the patent chosen.		Celia van Gelder|Mateusz Kuzak|Yan Wang								
obo:T4FS_0000498	peer review	assessment	A process by which a scholarly work (such as a paper or a research proposal) is checked by a group of experts in the same field to make sure it meets the necessary standards before it is published or accepted.	Definition from now-deprecated CASRAI Glossary term: peer-review	https://orcid.org/0000-0002-7702-4495|https://orcid.org/0000-0003-2687-1982|https://orcid.org/0000-0002-5214-4466								
obo:T4FS_0000453	persistent identifier	'contributes to the implementation of' some 'F1. (meta)data are assigned a globally unique and persistent identifier'|identifier	Long-lasting digital reference to an object that gives information about that object regardless of what happens to that object. Developed to address link rot, a persistent identifier can be resolved to provide an appropriate representation of an object whether that object changes its online location or goes offline.	RDMT. https://terms.codata.org/rdmt/persistent-identifier	https://orcid.org/0000-0002-7702-4495|https://orcid.org/0000-0003-2687-1982|https://orcid.org/0000-0002-5214-4466	PID							
obo:T4FS_0000443	persistent uniform resource locator	'contributes to the implementation of' some 'F1. (meta)data are assigned a globally unique and persistent identifier'|persistent identifier	URL that points to an intermediate resolution service. The PURL resolution service associates the PURL with the actual URL and returns that URL to the client.	RDMT. https://terms.codata.org/rdmt/persistent-uniform-resource-locator	https://orcid.org/0000-0002-7702-4495|https://orcid.org/0000-0003-2687-1982|https://orcid.org/0000-0002-5214-4466	PURL							
obo:T4FS_0000127	personal information privacy	data stewardship technical concept	The World Wide Web Consortium’s Platform for Personal Privacy Project (P3P) offers specific recommendations for practices that will let users define and share personal information with Web sites that they agree to share it with. The P3P incorporates a number of industry proposals, including the Open Profiling Standard (OPS). Using software that adheres to the P3P recommendations, users will be able to create a personal profile, all or parts of which can be made accessible to a Web site as the user directs. A tool that will help a user decide whether to trust a given website with personal information is a Statement of Privacy Policy that a website can post.	RDMT. https://terms.codata.org/rdmt/personal-information-privacy	https://orcid.org/0000-0002-7702-4495|https://orcid.org/0000-0003-2687-1982|https://orcid.org/0000-0002-5214-4466								
obo:T4FS_0000222	personally identifiable information	personal information privacy	Data that relate to a living individual who can be identified from those data or those data plus other information which is in the possession of, or is likely to come into the possession of, the data controller, and includes any expression of opinion about the individual and any indication of the intentions of the data controller or any other person in respect of the individual. Any information that can be used to distinguish one person from another and can be used for de-anonymising anonymous data can be considered personally identifiable data.	RDMT. https://terms.codata.org/rdmt/personally-identifiable-information	https://orcid.org/0000-0002-7702-4495|https://orcid.org/0000-0003-2687-1982|https://orcid.org/0000-0002-5214-4466	Personal data							
obo:T4FS_0000337	pid attribute	'contributes to the implementation of' some 'F1. (meta)data are assigned a globally unique and persistent identifier'|persistent identifier	Single data element related to a PID and part of its record content.	RDMT. https://terms.codata.org/rdmt/pid-attribute	https://orcid.org/0000-0002-7702-4495|https://orcid.org/0000-0003-2687-1982|https://orcid.org/0000-0002-5214-4466								
obo:T4FS_0000365	pid domain	'contributes to the implementation of' some 'F1. (meta)data are assigned a globally unique and persistent identifier'|persistent identifier	For a single identifier, the class of entity it refers to. For a PID system, the typical class of entities it is intended to be used for, such as digital objects, physical objects, bodies, actors.	RDMT. https://terms.codata.org/rdmt/pid-domain	https://orcid.org/0000-0002-7702-4495|https://orcid.org/0000-0003-2687-1982|https://orcid.org/0000-0002-5214-4466								
obo:T4FS_0000239	pid record	'contributes to the implementation of' some 'F1. (meta)data are assigned a globally unique and persistent identifier'|persistent identifier	Type of record (and organisation) that stores an instance of an executable/understandable PID. The content of a PID record distinguishes a registered digital or data object from other digital objects. A PID record is a type of record that includes property information that characterises the digital object it is identifying. Important parts of a PID record are location and checksum. However there is a large variation in usage. In some data models the PID is simply used as a unique label with an empty record. A PID record has a lifecycle including creation, publication, curation and destruction. 	RDMT. https://terms.codata.org/rdmt/pid-record	https://orcid.org/0000-0002-7702-4495|https://orcid.org/0000-0003-2687-1982|https://orcid.org/0000-0002-5214-4466								
obo:T4FS_0000540	pid resolution	'contributes to the implementation of' some 'F1. (meta)data are assigned a globally unique and persistent identifier'|persistent identifier	The process of resolving a PID to a useful state of information about a digital object by using a globally available system.	RDMT. https://terms.codata.org/rdmt/pid-resolution	https://orcid.org/0000-0002-7702-4495|https://orcid.org/0000-0003-2687-1982|https://orcid.org/0000-0002-5214-4466								
obo:T4FS_0000139	pid service	'contributes to the implementation of' some 'F1. (meta)data are assigned a globally unique and persistent identifier'|persistent identifier	Service that provides a connection between a PID and its target object.	RDMT. https://terms.codata.org/rdmt/pid-service	https://orcid.org/0000-0002-7702-4495|https://orcid.org/0000-0003-2687-1982|https://orcid.org/0000-0002-5214-4466								
obo:T4FS_0000360	pid system	'contributes to the implementation of' some 'F1. (meta)data are assigned a globally unique and persistent identifier'|persistent identifier	Consists of at least one PID resolver, a name schema and a defined mechanism for issuing PIDs that conform to the name schema.	RDMT. https://terms.codata.org/rdmt/pid-system	https://orcid.org/0000-0002-7702-4495|https://orcid.org/0000-0003-2687-1982|https://orcid.org/0000-0002-5214-4466								
obo:T4FS_0000002	pipe separated values	'contributes to the implementation of' some 'I1. (meta)data use a formal, accessible, shared, and broadly applicable language for knowledge representation'|data stewardship technical concept	Values in a table presented as a series of ASCII text lines organised so that each column value is separated by a pipe ( | ).	RDMT. https://terms.codata.org/rdmt/pipe-separated-values	https://orcid.org/0000-0002-7702-4495|https://orcid.org/0000-0003-2687-1982|https://orcid.org/0000-0002-5214-4466								
obo:T4FS_0000211	presentation slides	learning medium			https://orcid.org/0000-0003-2687-1982				https://orcid.org/0000-0003-2687-1982	2020-10-01T20:52:43.543314Z			
obo:T4FS_0000421	presentation slides with interactive exercises	presentation slides							https://orcid.org/0000-0003-2687-1982	2020-11-16T22:18:14.764875Z			
obo:T4FS_0000017	preservation	archiving	An activity within archiving in which specific items of data are maintained over time so that they can still be accessed and understood through changes in technology.	RDMT. https://terms.codata.org/rdmt/preservation	https://orcid.org/0000-0002-7702-4495|https://orcid.org/0000-0003-2687-1982|https://orcid.org/0000-0002-5214-4466	Conservation							
obo:T4FS_0000104	preservation costs management	resource management	Planning for and controlling the present and future costs of the conservation of data, including technical storage, fixed costs, and staff resources.	Based on https://www.cessda.eu/About/Projects/Past-projects/CESSDA-SaW/WP4/Cost-Benefit-Advocacy-Toolkit/Costs-Factsheet [LLC]	Kristina Hettne|Leighton Christiansen|Simon Hodson|Victoria Dominguez Del Angel								
obo:T4FS_0000410	preservation metadata	'contributes to the implementation of' some 'F2. data are described with rich metadata'|metadata	Documents actions that have been undertaken to preserve a digital resource such as migrations and checks sum calculations.	RDMT. https://terms.codata.org/rdmt/preservation-metadata	https://orcid.org/0000-0002-7702-4495|https://orcid.org/0000-0003-2687-1982|https://orcid.org/0000-0002-5214-4466								
obo:T4FS_0000441	principal investigator	manager	The Principal Investigator (P.I.) is a researcher who has a research leadership role and is the point of contact for a project or partnership that applies the scientific method, historical method, or other research methodology for the advancement of knowledge resulting in independent, objective, high quality, traceable, and reproducible results. The P.I. has primary responsibility for the intellectual direction and integrity of the research or research-related activity, including data production, findings and results, and ensures ethical conduct in all aspects of the research process including but not limited to the treatment of human and animal subjects, conflicts of interest, data acquisition, sharing and ownership, publication practices, responsible authorship, and collaborative research and reporting. While various tasks may be delegated to team members, some of whom may have greater expertise in specific areas, the P.I. is familiar with the various technical and scientific aspects of a project and how they fit together, is able to identify and remediate gaps, and ensure communication within the team and with users of the research data and results.	Definition from now-deprecated CASRAI Glossary term: principal-investigator	https://orcid.org/0000-0002-7702-4495|https://orcid.org/0000-0003-2687-1982|https://orcid.org/0000-0002-5214-4466								
obo:T4FS_0000524	privacy governance	governance	Monitoring the risk to privacy posed by data requests from researchers, and the practices of data custodians in providing data (information governance) to ensure that confidentiality is protected. Such governance requires specialised knowledge of technology, law, and statistical methods.	RDMT. https://terms.codata.org/rdmt/privacy-governance	https://orcid.org/0000-0002-7702-4495|https://orcid.org/0000-0003-2687-1982|https://orcid.org/0000-0002-5214-4466								
obo:T4FS_0000192	privacy-preserving data linkage	data stewardship technical concept	Data linkage where the resulting product has been de-identified.	RDMT. https://terms.codata.org/rdmt/privacy-preserving-data-linkage	https://orcid.org/0000-0002-7702-4495|https://orcid.org/0000-0003-2687-1982|https://orcid.org/0000-0002-5214-4466								
BFO:0000015	process												
obo:TF4S_0000572	procurement officer	role			https://orcid.org/0000-0002-7702-4495						AL 16.3.22: Added as part of FAIR Cookbook integration. Useful for such roles to be able to understand the cost of e.g. making things FAIR (and how to deal with it), but also the benefits.		
obo:T4FS_0000203	program governance	governance	The process of developing, communicating, implementing, monitoring, and assuring the policies, procedures, organizational structures, and practices associated with a given program.	Definition from now-deprecated CASRAI Glossary term: program-governance	https://orcid.org/0000-0002-7702-4495|https://orcid.org/0000-0003-2687-1982|https://orcid.org/0000-0002-5214-4466								
obo:T4FS_0000442	program manager	manager	The person responsible for creating the organizational environment culture by providing clear direction and circumstances that allow people to be successful. The program manager is judged on the elements time, cost, and scope, cumulatively for all the projects and operations within the program. Program management decisions are both tactical and strategic in nature. The strategy aspects of these decisions must consider multidimensional impacts beyond the near-term delivery dates of the project. In addition to delivery and execution, the program manager has to also be concerned with the overall health and effectiveness of the program over the long term.	Definition from now-deprecated CASRAI Glossary term: program-manager	https://orcid.org/0000-0002-7702-4495|https://orcid.org/0000-0003-2687-1982|https://orcid.org/0000-0002-5214-4466								
