ID	LABEL	Parent	IAO:0000115	IAO:0000119	IAO:0000117	IAO:0000118	obo:T4FS_0000564	obo:T4FS_0000565	oboInOwl:created_by	oboInOwl:creation_date	rdfs:comment	owl:deprecated	obo:IAO_0000233
ID	AL rdfs:label@en	SC % SPLIT=|	AL definition@en	>AL 'definition source'@en	AL 'term editor'@en SPLIT=|	AL 'alternative term'@en SPLIT=|	AL 'alternative definition'@en	AL 'alternative definition source'@en	AL 'created by'@en	A creation date	AL comment@en	AT owl:deprecated^^xsd:boolean	AL 'term tracker item'@en SPLIT=|
obo:T4FS_0000088	a knowledge for resource management	resource management	Bin for types of Knowledge related to Resource management		leightonlc								
obo:T4FS_0000038	A1. (meta)data are retrievable by their identifier using a standardised communications protocol	accessibility of digital assets			Peter McQuilton								
obo:T4FS_0000103	A1.1 the protocol is open, free, and universally implementable	A1. (meta)data are retrievable by their identifier using a standardised communications protocol			Peter McQuilton								
obo:T4FS_0000371	A1.2 the protocol allows for an authentication and authorisation procedure, where necessary	A1. (meta)data are retrievable by their identifier using a standardised communications protocol			Peter McQuilton								
obo:T4FS_0000438	A2. metadata are accessible, even when the data are no longer available	accessibility of digital assets			Peter McQuilton								
obo:T4FS_0000399	ability to learn new techniques for fair implementation	'requires/improves personal attribute' only 'data stewardship soft skill'|'requires/improves personal attribute' some 'data stewardship soft skill'|aptitudes associated with using fair tools and services	Demonstrate willingness to engage with new ways of applying FAIR principles.		Angus Whyte								
obo:T4FS_0000129	ability to solve fair implementation problems collaboratively	ability to learn new techniques for fair implementation	Demonstrate ability to involve others and share responsibility for applying FAIR principles.	[PMQ, 3.2022]	Angus Whyte								
obo:T4FS_0000283	access	data stewardship technical concept	The continued, available for use, ongoing usability of a digital resource, retaining all qualities of authenticity, accuracy and functionality deemed to be essential for the purposes the digital material was created and/or acquired for. Users who have access can retrieve, manipulate, copy, and store copies on a wide range of hard drives and external devices.	CASRAI. https://casrai.org/term/access	Peter McQuilton								
obo:T4FS_0000469	access control and management	publish data											
obo:T4FS_0000463	access control list	access	A list used to grant permission matched against credentials.	CASRAI. https://casrai.org/term/access-control-list/	Peter McQuilton								
obo:T4FS_0000523	access controls	access	Given a data object name, access controls define access relationships between the following metadata: data object name, a user name (or user group, or user role), and access permission. The information can be stored as metadata information associated with each data object. The information can be generated dynamically by applying the access controls of the collection that organizes the data objects.	CASRAI. https://casrai.org/term/access-controls/	Peter McQuilton								
obo:T4FS_0000209	access risk assessment and mitigation	information security	Obtain an overview of information access status for different stakeholder groups. Check this overview against the organizational information access policy and risk catalogue, identify the type of information security risks based on the mismatch between the current status and policy. Choose and implement the right protocal to mitigate the risk.		Angus Whyte|Celia van Gelder|Mateusz Kuzak|Yan Wang								
obo:T4FS_0000377	access workflow	access	A type of access entity that contains the services and functions which make the data object holdings and their information content and related services visible to data consumers.	CASRAI. https://casrai.org/term/access-workflow/	Peter McQuilton								
obo:T4FS_0000478	accessibility of digital assets	fair principle			Peter McQuilton								
obo:T4FS_0000316	accession number	'contributes to the implementation of' some 'F1. (meta)data are assigned a globally unique and persistent identifier'|identifier	Numbers used by the National Center for Biotechnology Information (NCBI) that are unique and citable.	CASRAI. https://casrai.org/term/accession-number/	Peter McQuilton								
obo:T4FS_0000356	advise and mentor	('competency gained through' some ('learning medium' and ('supports implementation of' some 'fair principle')))|data stewardship activity	Management and provision of good data stewardship practice.	PMQ	https://orcid.org/0000-0002-7702-4495|Peter McQuilton|Philippe Rocca-Serra|Susanna Sansone	Advise and enable|Data Stewardship and FAIR mentorship activity|data management and open research					AL 9.3.22. Removed from 'FAIR4S defined activity' class to better integrate with the T4FS hierarchy.		
obo:T4FS_0000311	analytical quality control	data stewardship technical concept	Processes and procedures designed to ensure that the results of laboratory analysis are consistent, comparable, accurate and within specified limits of precision.	CASRAI. https://casrai.org/term/analytical-quality-control/	Peter McQuilton								
obo:T4FS_0000547	analytics	data stewardship technical concept	The discovery of meaningful multidimensional patterns in data.	CASRAI. https://casrai.org/term/analytics/	Peter McQuilton								
obo:T4FS_0000502	application of fair tools and services	using fair and open research tools or services							HughShanahan	2019-10-18T08:45:02.980527Z			
obo:T4FS_0000075	apply data access policy	access control and management	Define data access policy based on project requirements. Provide access to autorised parties.		Celia van Gelder|Mateusz Kuzak|Yan Wang								
obo:T4FS_0000483	appreciate importance of crediting research contributions	research integrity, attribution, impact awareness	Understand how the rewards for effort depend on crediting the contributions of researchers and professional groups towards making FAIR outputs.		Angus Whyte|Celia van Gelder|Mateusz Kuzak|Yan Wang								
obo:T4FS_0000240	appreciate importance of research integrity	research integrity, attribution, impact awareness	Take proactive approach to ensure outputs are made FAIR consistently with research integrity principles.		Angus Whyte|Celia van Gelder|Mateusz Kuzak|Yan Wang								
obo:T4FS_0000380	appreciate security and usability trade-offs	information security	Be aware of the potential conflicts between security and usability. Understand the importance of having information security policy and keeping a balance between the information security and usability. Willing to establish both organization and technical information security measurements.		Angus Whyte|Celia van Gelder|Mateusz Kuzak|Yan Wang								
obo:T4FS_0000398	appreciation of fair and open research	develop open research strategy and vision	Recognize the added value of FAIR and open research, encourage researchers to practise FAIR and open research.		Angus Whyte|Celia van Gelder|Mateusz Kuzak|Yan Wang								
obo:T4FS_0000408	aptitudes associated with using fair tools and services	using fair and open research tools or services							HughShanahan	2019-10-18T08:56:32.673701Z			
obo:T4FS_0000125	aptitudes for authorisation management	authorisation management	Bin for Aptitudes related to Authorization management.		leightonlc								
obo:T4FS_0000338	aptitudes for change management	change management	Bin for Aptitudes related to Change management.		leightonlc								
obo:T4FS_0000448	aptitudes for cloud computing environment management	cloud computing environment management	Bin for Aptitudes related to Cloud computing environment management.		leightonlc								
obo:T4FS_0000230	aptitudes for data management costs management	data management costs management	Bin for Aptitudes related to Data management costs management.		leightonlc								
obo:T4FS_0000400	aptitudes for funding acquisition management	funding acquisition management	Bin for Aptitudes related to Funding acquisition management.		leightonlc								
obo:T4FS_0000277	aptitudes for high performance computing management	high performance computing management	Bin for Aptitudes related to High performance computing management.		leightonlc								
obo:T4FS_0000123	aptitudes for identity management	identity management	Bin for Aptitudes related to Identity management.		leightonlc								
obo:T4FS_0000477	aptitudes for preservation costs management	preservation costs management	Bin for Aptitudes related to Preservation costs management.		leightonlc								
obo:T4FS_0000062	aptitudes for provenance information management	provenance information management	Bin for Aptitudes related to Provenance information management.		leightonlc								
obo:T4FS_0000089	aptitudes for resource management	resource management	Bin for Aptitudes related to Resource management.		leightonlc								
obo:T4FS_0000348	aptitudes for service level management	service level management	Bin for Aptitudes related to Service level management.		leightonlc								
obo:T4FS_0000355	aptitudes for storage management	storage management	Bin for Aptitudes related to Storage management.		leightonlc								
obo:T4FS_0000023	aptitudes for workflow technologies management	workflow technologies management	Bin for Aptitudes related to Workflow technologies management.		leightonlc								
obo:T4FS_0000550	archival documentation of data	('competency gained through' some ('learning medium' and ('supports implementation of' some 'fair principle')))|archiving	Ability to apply the FAIR principles i.e. describe the data with community metadata standard for machine and human, align with existing semantic models (ontologies, controlled vocabularies, ...), get a persistent ID, attribute licence and credit for data creators, legal aspect related to data (ownership, confidentiality, ethics, ...) add data provenance.	[YLF, VDA, KH]	https://orcid.org/0000-0002-7702-4495|Kristina Hettne|Victoria Dominguez Del Angel|Yann Le Franc								
obo:T4FS_0000374	archival documentation of software	archiving	Ability to clean up existing source code and version control systems, get Unique ID for the code, choose the appropriate code repository/registry [YLF, VDA, KH]		https://orcid.org/0000-0002-7702-4495|Kristina Hettne|Victoria Dominguez Del Angel|Yann Le Franc								
obo:T4FS_0000149	archive	data stewardship technical concept	A place or collection containing static records, documents, or other materials for long-term preservation.	CASRAI. https://casrai.org/term/archive/	Peter McQuilton								
obo:T4FS_0000156	archiving	data stewardship activity	A curation activity that ensures that data are properly selected, stored, and can be accessed, and for which logical and physical integrity are maintained over time, including security and authenticity.	CASRAI. https://casrai.org/term/archiving/	Peter McQuilton								
obo:T4FS_0000288	assess fairness	('competency gained through' some ('learning medium' and ('supports implementation of' some 'fair principle')))|assessment	Activity/Process whereby digital objects are evaluated with the relevant FAIR metrics and assessment tools.	[YLF, VDA, KH]	Kristina Hettne|Victoria Dominguez Del Angel|Yann Le Franc								
obo:T4FS_0000126	assessment	data stewardship activity			https://orcid.org/0000-0002-7702-4495|Angus Whyte|Celia van Gelder|Mateusz Kuzak|Yan Wang						AL 17.3.22: Updated to "Assessment" to match the style of its sibling classes. AL 3.22: Was "govern and assess", which is a compound concept. Split into two classes, Assess and Governance. Original source: FAIR4S defined activity.		
obo:T4FS_0000049	audit	assessment	An independent evaluation of an organization, system, process, project or product.	CASRAI. https://casrai.org/term/audit/	Peter McQuilton								
obo:T4FS_0000270	authentication	information security	The process of confirming the identity of a principal entity.	CASRAI. https://casrai.org/term/authentication/	Peter McQuilton								
obo:T4FS_0000219	authenticity metadata	'contributes to the implementation of' some 'I1. (meta)data use a formal, accessible, shared, and broadly applicable language for knowledge representation'|data stewardship technical concept	A type of metadata that conveys information needed to link a data object to its original source.	CASRAI. https://casrai.org/term/authenticity-metadata/	Peter McQuilton								
obo:T4FS_0000142	authorisation management	resource management	Authorization management is concerned with people's access to different objects, most often to data or physical objects, such as land, buildings, rooms or infrastructure.	https://managementmania.com/en/authorization-management	Kristina Hettne|Leighton Christiansen|Simon Hodson|Victoria Dominguez Del Angel								
obo:T4FS_0000251	big data	data	An evolving term that describes any voluminous amount of structured, semi-structured and unstructured data that have the potential to be mined for information.	CASRAI. https://casrai.org/term/big-data/	Peter McQuilton								
obo:T4FS_0000305	book	learning medium			Peter McQuilton				Peter McQuilton	2020-10-01T20:54:08.535183Z			
obo:T4FS_0000432	book chapter	book							Peter McQuilton	2020-10-01T20:53:37.24517Z			
obo:T4FS_0000373	canonical data collection	data stewardship technical concept	A data collection that has been normalized by some established criteria to allow for effective data management. Examples include: data files that belong to a certain experiment, all files that are created by one specific simulation, all files that belong to a specific observation (same day, same place, etc.).	CASRAI. https://casrai.org/term/canonical-data-collection/	Peter McQuilton								
obo:T4FS_0000425	catalogue	data stewardship technical concept	A type of collection that describes, and points to features of another collection.	CASRAI. https://casrai.org/term/catalogue/	Peter McQuilton								
obo:T4FS_0000070	cataloguing	curation	An intellectual process of describing objects in accordance with accepted library principles, particularly those of subject and classification order.	CASRAI. https://casrai.org/term/cataloguing/	Peter McQuilton								
obo:T4FS_0000411	change management	resource management	Change management is a broad subject and can be applied to all different types of organizational change. The most common change drivers include:  technological evolution, process reviews, crisis, and consumer habit changes; pressure from new business entrants, acquisitions, mergers, and organizational restructuring.	https://www.hucmi.com/en/hcmbok/	Kristina Hettne|Leighton Christiansen|Simon Hodson|Victoria Dominguez Del Angel	CM							
obo:T4FS_0000401	choosing the appropriate model or format for your data	('competency gained through' some ('learning medium' and ('supports implementation of' some 'I1. (meta)data use a formal, accessible, shared, and broadly applicable language for knowledge representation')))|fair evaluation of repositories for data deposition	To be able to choose the correct data model and/or exchange format for your data, based on the repository where you plan to deposit your data.	[PMQ]	Peter McQuilton	Which data model to use|Which format to use							
obo:T4FS_0000011	choosing the appropriate reporting guideline for your data	('competency gained through' some ('learning medium' and ('supports implementation of' some 'I1. (meta)data use a formal, accessible, shared, and broadly applicable language for knowledge representation')))|('competency gained through' some ('learning medium' and ('supports implementation of' some 'I3. (meta)data include qualified references to other (meta)data')))|fair evaluation of repositories for data deposition	To be able to choose the appropriate reporting guideline/checklist for your data, based on community-adopted standards.	[PMQ]	Peter McQuilton								
obo:T4FS_0000294	choosing the appropriate terminology for your data	fair evaluation of repositories for data deposition	To be able to research and identify the appropriate taxonomy for your project. This may involve using resources such as FAIRsharing, which captures metadata on taxonomies and provides an assessment of their FAIRness.	[PMQ]	Peter McQuilton	Controlled Vocabulary identification|Ontology identification|Taxonomy identification|Thesaurus identification							
obo:T4FS_0000250	citable data	'contributes to the implementation of' some 'F1. (meta)data are assigned a globally unique and persistent identifier'|data	A type of referable data that has undergone quality assessment and can be referred to as citations in publications and as part of research objects.	CASRAI. https://casrai.org/term/citable-data/	Peter McQuilton								
obo:T4FS_0000133	cite contributions	('competency gained through' some ('learning medium' and ('supports implementation of' some 'F1. (meta)data are assigned a globally unique and persistent identifier')))|('competency gained through' some ('learning medium' and ('supports implementation of' some 'F3. metadata clearly and explicitly include the identifier of the data they describe')))|exposing data	Cite contributions to data work in published literature which draws upon that data.	[LM]	Laura Molloy|Peter McQuilton								
obo:T4FS_0000271	cloud computing	data stewardship technical concept	A large-scale distributed computing paradigm that is driven by economies of scale, in which a pool of abstracted, virtualized, dynamically- scalable, managed computing power, storage, platforms and services are delivered on demand to external customers over the Internet.	CASRAI. https://casrai.org/term/cloud-computing/	Peter McQuilton								
obo:T4FS_0000479	cloud computing environment management	resource management	The activity of bringing computer system resources, especially data storage and computing power on demand via Internet.	(modified from wikipedia) [VDA]	Kristina Hettne|Simon Hodson|Victoria Dominguez Del Angel								
obo:T4FS_0000146	cloud ecosystem	data stewardship technical concept	An ecosystem that includes not only traditional elements of cloud computing such as software and infrastructure, but also consultants, integrators, partners, third parties and anything in their environments that has a bearing on the other components.	CASRAI. https://casrai.org/term/cloud-ecosystem/	Peter McQuilton								
obo:T4FS_0000287	collection management identification	data stewardship technical concept	A type of data provenance that adds metadata to identify data collections.	CASRAI. https://casrai.org/term/collection-management-identification/	Peter McQuilton								
obo:T4FS_0000528	comma separated values	'contributes to the implementation of' some 'I1. (meta)data use a formal, accessible, shared, and broadly applicable language for knowledge representation'|data stewardship technical concept	A file that contains the values in a table as a series of ASCII text lines organized so that each column value is separated by a comma from the next column's value and each row starts a new line.	CASRAI. https://casrai.org/term/comma-separated-values/	Peter McQuilton						Maybe remove as shouldn't have formats here.		
obo:T4FS_0000249	community building	project management activities			https://orcid.org/0000-0002-7702-4495|Peter McQuilton|Philippe Rocca-Serra|Susanna Sansone						AL 9.3.22: renamed to prevent compound term. Was 'Influencing/community building'		
obo:T4FS_0000475	computer code	data stewardship technical concept	A series of computer instructions written in some human readable computer language, usually stored in a text file.	CASRAI. https://casrai.org/term/computer-code/	Peter McQuilton								
obo:T4FS_0000079	conducting operations	project management activities			https://orcid.org/0000-0002-7702-4495|Peter McQuilton|Philippe Rocca-Serra|Susanna Sansone								
obo:T4FS_0000552	confidential information	data stewardship technical concept	Any information obtained by a person on the understanding that they will not disclose it to others, or obtained in circumstances where it is expected that they will not disclose it.	CASRAI. https://casrai.org/term/confidential-information/	Peter McQuilton								
obo:T4FS_0000227	confidentiality	data stewardship technical concept	The duties and practices of people and organizations to ensure that individual's personal information only flows from one entity to another according to legislated or otherwise broadly accepted norms and policies.	CASRAI. https://casrai.org/term/confidentiality/	Peter McQuilton								
obo:T4FS_0000275	conformance	data stewardship technical concept	The state of having satisfied the requirements of some specific standard(s) and/or specification(s).	CASRAI. https://casrai.org/term/conformance/	Peter McQuilton								
obo:T4FS_0000168	consensus standard	'contributes to the implementation of' some 'I1. (meta)data use a formal, accessible, shared, and broadly applicable language for knowledge representation'|data stewardship technical concept	A standard developed through the cooperation of all parties who have an interest in participating in its development and/or use.	CASRAI. https://casrai.org/term/consensus-standard/	Peter McQuilton	Community standard							
BFO:0000002	continuant												
obo:T4FS_0000335	controlled vocabulary	'contributes to the implementation of' some 'I3. (meta)data include qualified references to other (meta)data'|data stewardship technical concept	A list of standardized terminology, words, or phrases, used for indexing or content analysis and information retrieval, usually in a defined information domain.	CASRAI. https://casrai.org/term/controlled-vocabulary/	Peter McQuilton								
obo:T4FS_0000217	core trust seal	repository certification schemes	CoreTrustSeal offers to any interested data repository a core level certification based on the DSAâ€“WDS Core Trustworthy Data Repositories Requirements catalogue and procedures. This universal catalogue of requirements reflects the core characteristics of trustworthy data repositories and is the culmination of a cooperative effort between DSA and WDS under the umbrella of the Research Data Alliance to merge their data repositories certifications.	https://www.coretrustseal.org/about/	Peter McQuilton	CTS			Peter McQuilton	2021-02-17T22:12:12.996581Z			
obo:T4FS_0000480	corpus	data stewardship technical concept	A set of documents that has a scientific meaning. A corpus can be produced by an individual researchers activity (including its archival materials), or from a laboratory research, field campaign or science and culture heritage project, a survey, etc.	CASRAI. https://casrai.org/term/corpus/	Peter McQuilton								
obo:T4FS_0000422	creating persistent identifiers	understanding persistent identifiers							Peter McQuilton	2020-10-02T14:23:05.600474Z			
obo:T4FS_0000165	creativity	data stewardship soft skill	The ability to have an innovative approach to research by creating new or modified current concepts, theories, approaches and/or solutions.	CASRAI. https://casrai.org/term/creativity/	Peter McQuilton								
obo:T4FS_0000362	cross-disciplinary	data stewardship technical concept	Explains aspects of one discipline in terms of another (e.g., the physics of music; the politics of literature).	CASRAI. https://casrai.org/term/cross-disciplinary/	Peter McQuilton								
obo:T4FS_0000265	curated data	'contributes to the implementation of' some 'F3. metadata clearly and explicitly include the identifier of the data they describe'|'contributes to the implementation of' some 'I2. (meta)data use vocabularies that follow fair principles'|'contributes to the implementation of' some 'R1. (meta)data are richly described with a plurality of accurate and relevant attributes'|'contributes to the implementation of' some 'fair principle'|'contributes to the implementation of' some 'findability of digital assets'|data	The output of a data curation activity. Such data has generally already been cleaned, standardised, documented. Additional metadata relevant to the data object has also been added, via either manual or automatic methods.	AL 9.5.22	https://orcid.org/0000-0002-7702-4495|Peter McQuilton				Peter McQuilton		AL 9.5.22: The orginal label ("data curation") matched a term within the Data stewardship activity hierarchy. Changing the class label to "Curated data" better fit the model.		
obo:T4FS_0000036	curation	('competency gained through' some ('learning medium' and ('supports implementation of' some 'fair principle')))|data stewardship activity	The activity of managing and promoting the use of data from their point of creation to ensure that they are fit for contemporary purpose and available for discovery and reuse.	CASRAI. https://casrai.org/term/curation/	Peter McQuilton								
obo:T4FS_0000102	curation workflow	data stewardship technical concept	A type of workflow that includes active steps to curate data as an aid to on-going management of data through its lifecycle.	CASRAI. https://casrai.org/term/curation-workflow/	Peter McQuilton								
obo:T4FS_0000546	darwin information typing architecture	data stewardship technical concept	A document creation and management specification that builds content reuse into the authoring process.	CASRAI. https://casrai.org/term/darwin-information-typing-architecture/	Peter McQuilton								
obo:T4FS_0000430	data	data stewardship technical concept	Facts, measurements, recordings, records, or observations about the world collected by scientists and others, with a minimum of contextual interpretation.	CASRAI. https://casrai.org/term/data/	Peter McQuilton								
