ID	LABEL	Parent	IAO:0000115	IAO:0000119	IAO:0000117	IAO:0000118	obo:T4FS_0000564	obo:T4FS_0000565	oboInOwl:created_by	oboInOwl:creation_date	rdfs:comment	owl:deprecated	obo:IAO_0000233
ID	AL rdfs:label@en	SC % SPLIT=|	AL definition@en	>AL 'definition source'@en	AL 'term editor'@en SPLIT=|	AL 'alternative term'@en SPLIT=|	AL 'alternative definition'@en	AL 'alternative definition source'@en	AL 'created by'@en	A creation date	AL comment@en	AT owl:deprecated^^xsd:boolean	AL 'term tracker item'@en SPLIT=|
obo:T4FS_0000088	a knowledge for resource management	resource management	Bin for types of Knowledge related to Resource management		leightonlc								
obo:T4FS_0000038	A1. (meta)data are retrievable by their identifier using a standardised communications protocol	accessibility of digital assets			https://orcid.org/0000-0003-2687-1982								
obo:T4FS_0000103	A1.1 the protocol is open, free, and universally implementable	A1. (meta)data are retrievable by their identifier using a standardised communications protocol			https://orcid.org/0000-0003-2687-1982								
obo:T4FS_0000371	A1.2 the protocol allows for an authentication and authorisation procedure, where necessary	A1. (meta)data are retrievable by their identifier using a standardised communications protocol			https://orcid.org/0000-0003-2687-1982								
obo:T4FS_0000438	A2. metadata are accessible, even when the data are no longer available	accessibility of digital assets			https://orcid.org/0000-0003-2687-1982								
obo:T4FS_0000399	ability to learn new techniques for fair implementation	'requires/improves personal attribute' only 'data stewardship soft skill'|'requires/improves personal attribute' some 'data stewardship soft skill'|aptitudes associated with using fair tools and services	Demonstrate willingness to engage with new ways of applying FAIR principles.		Angus Whyte								
obo:T4FS_0000129	ability to solve fair implementation problems collaboratively	ability to learn new techniques for fair implementation	Demonstrate ability to involve others and share responsibility for applying FAIR principles.	[PMQ, 3.2022]	Angus Whyte								
obo:T4FS_0000283	access	data stewardship technical concept	Continued availability and ongoing usability of a digital resource, retaining all qualities of authenticity, accuracy and functionality deemed to be essential for the purposes the digital material was created and/or acquired for. Users who have access can retrieve, understand, manipulate, and store copies. 	RDMT. https://terms.codata.org/rdmt/access	https://orcid.org/0000-0003-2687-1982|https://orcid.org/0000-0002-5214-4466								
obo:T4FS_0000469	access control and management	publish data											
obo:T4FS_0000463	access control list	access	A list used to grant permission matched against credentials.	Definition from now-deprecated CASRAI Glossary term: access-control-list.	https://orcid.org/0000-0003-2687-1982|https://orcid.org/0000-0002-5214-4466								
obo:T4FS_0000523	access controls	access	Definitions of the access relationships between the following metadata: data object name, a user name (or user group, or user role), and access permission(s). The information can be stored as metadata information associated with each data object. The information can be generated dynamically by applying the access controls of the collection that organises the data objects (if a collection sticky bit is turned on). 	RDMT. https://terms.codata.org/rdmt/access-controls	https://orcid.org/0000-0003-2687-1982|https://orcid.org/0000-0002-5214-4466								
obo:T4FS_0000209	access risk assessment and mitigation	information security	Obtain an overview of information access status for different stakeholder groups. Check this overview against the organizational information access policy and risk catalogue, identify the type of information security risks based on the mismatch between the current status and policy. Choose and implement the right protocal to mitigate the risk.		Angus Whyte|Celia van Gelder|Mateusz Kuzak|Yan Wang								
obo:T4FS_0000377	access workflow	access	Type of access entity that contains the services and functions which make the data object holdings and their information content and related services visible to data consumers.	RDMT. https://terms.codata.org/rdmt/access-workflow	https://orcid.org/0000-0003-2687-1982|https://orcid.org/0000-0002-5214-4466								
obo:T4FS_0000478	accessibility of digital assets	fair principle			https://orcid.org/0000-0003-2687-1982								
obo:T4FS_0000316	accession number	'contributes to the implementation of' some 'F1. (meta)data are assigned a globally unique and persistent identifier'|identifier	Numbers used by the National Center for Biotechnology Information (NCBI) that are unique and citable.	Definition from now-deprecated CASRAI Glossary term: accession-number	https://orcid.org/0000-0003-2687-1982|https://orcid.org/0000-0002-5214-4466								
obo:T4FS_0000356	advise and mentor	('competency gained through' some ('learning medium' and ('supports implementation of' some 'fair principle')))|data stewardship activity	Management and provision of good data stewardship practice.	PMQ	https://orcid.org/0000-0002-7702-4495|https://orcid.org/0000-0003-2687-1982|Philippe Rocca-Serra|Susanna Sansone	Advise and enable|Data Stewardship and FAIR mentorship activity|data management and open research					AL 9.3.22. Removed from 'FAIR4S defined activity' class to better integrate with the T4FS hierarchy.		
obo:T4FS_0000311	analytical quality control	data stewardship technical concept	Processes and procedures designed to ensure that the results of laboratory analysis are consistent, comparable, accurate and within specified limits of precision.	Definition from now-deprecated CASRAI Glossary term: analytical-quality-control	https://orcid.org/0000-0003-2687-1982|https://orcid.org/0000-0002-5214-4466								
obo:T4FS_0000547	analytics	data stewardship technical concept	The discovery of meaningful multidimensional patterns in data.	Definition from now-deprecated CASRAI Glossary term: analytics	https://orcid.org/0000-0003-2687-1982|https://orcid.org/0000-0002-5214-4466								
obo:T4FS_0000502	application of fair tools and services	using fair and open research tools or services							HughShanahan	2019-10-18T08:45:02.980527Z			
obo:T4FS_0000075	apply data access policy	access control and management	Define data access policy based on project requirements. Provide access to autorised parties.		Celia van Gelder|Mateusz Kuzak|Yan Wang								
obo:T4FS_0000483	appreciate importance of crediting research contributions	research integrity, attribution, impact awareness	Understand how the rewards for effort depend on crediting the contributions of researchers and professional groups towards making FAIR outputs.		Angus Whyte|Celia van Gelder|Mateusz Kuzak|Yan Wang								
obo:T4FS_0000240	appreciate importance of research integrity	research integrity, attribution, impact awareness	Take proactive approach to ensure outputs are made FAIR consistently with research integrity principles.		Angus Whyte|Celia van Gelder|Mateusz Kuzak|Yan Wang								
obo:T4FS_0000380	appreciate security and usability trade-offs	information security	Be aware of the potential conflicts between security and usability. Understand the importance of having information security policy and keeping a balance between the information security and usability. Willing to establish both organization and technical information security measurements.		Angus Whyte|Celia van Gelder|Mateusz Kuzak|Yan Wang								
obo:T4FS_0000398	appreciation of fair and open research	develop open research strategy and vision	Recognize the added value of FAIR and open research, encourage researchers to practise FAIR and open research.		Angus Whyte|Celia van Gelder|Mateusz Kuzak|Yan Wang								
obo:T4FS_0000408	aptitudes associated with using fair tools and services	using fair and open research tools or services							HughShanahan	2019-10-18T08:56:32.673701Z			
obo:T4FS_0000125	aptitudes for authorisation management	authorisation management	Bin for Aptitudes related to Authorization management.		leightonlc								
obo:T4FS_0000338	aptitudes for change management	change management	Bin for Aptitudes related to Change management.		leightonlc								
obo:T4FS_0000448	aptitudes for cloud computing environment management	cloud computing environment management	Bin for Aptitudes related to Cloud computing environment management.		leightonlc								
obo:T4FS_0000230	aptitudes for data management costs management	data management costs management	Bin for Aptitudes related to Data management costs management.		leightonlc								
obo:T4FS_0000400	aptitudes for funding acquisition management	funding acquisition management	Bin for Aptitudes related to Funding acquisition management.		leightonlc								
obo:T4FS_0000277	aptitudes for high performance computing management	high performance computing management	Bin for Aptitudes related to High performance computing management.		leightonlc								
obo:T4FS_0000123	aptitudes for identity management	identity management	Bin for Aptitudes related to Identity management.		leightonlc								
obo:T4FS_0000477	aptitudes for preservation costs management	preservation costs management	Bin for Aptitudes related to Preservation costs management.		leightonlc								
obo:T4FS_0000062	aptitudes for provenance information management	provenance information management	Bin for Aptitudes related to Provenance information management.		leightonlc								
obo:T4FS_0000089	aptitudes for resource management	resource management	Bin for Aptitudes related to Resource management.		leightonlc								
obo:T4FS_0000348	aptitudes for service level management	service level management	Bin for Aptitudes related to Service level management.		leightonlc								
obo:T4FS_0000355	aptitudes for storage management	storage management	Bin for Aptitudes related to Storage management.		leightonlc								
obo:T4FS_0000023	aptitudes for workflow technologies management	workflow technologies management	Bin for Aptitudes related to Workflow technologies management.		leightonlc								
obo:T4FS_0000550	archival documentation of data	('competency gained through' some ('learning medium' and ('supports implementation of' some 'fair principle')))|archiving	Ability to apply the FAIR principles i.e. describe the data with community metadata standard for machine and human, align with existing semantic models (ontologies, controlled vocabularies, ...), get a persistent ID, attribute licence and credit for data creators, legal aspect related to data (ownership, confidentiality, ethics, ...) add data provenance.	[YLF, VDA, KH]	https://orcid.org/0000-0002-7702-4495|Kristina Hettne|Victoria Dominguez Del Angel|Yann Le Franc								
obo:T4FS_0000374	archival documentation of software	archiving	Ability to clean up existing source code and version control systems, get Unique ID for the code, choose the appropriate code repository/registry [YLF, VDA, KH]		https://orcid.org/0000-0002-7702-4495|Kristina Hettne|Victoria Dominguez Del Angel|Yann Le Franc								
obo:T4FS_0000149	archive	data stewardship technical concept	A place or collection containing static records, documents, or other materials for long-term preservation.	RDMT. https://terms.codata.org/rdmt/archive	https://orcid.org/0000-0003-2687-1982|https://orcid.org/0000-0002-5214-4466								
obo:T4FS_0000156	archiving	data stewardship activity	A curation activity that ensures that data are properly selected, stored, and can be accessed, and for which logical and physical integrity are maintained over time, including security and authenticity.	RDMT. https://terms.codata.org/rdmt/archive-verb	https://orcid.org/0000-0003-2687-1982|https://orcid.org/0000-0002-5214-4466								
obo:T4FS_0000288	assess fairness	('competency gained through' some ('learning medium' and ('supports implementation of' some 'fair principle')))|assessment	Activity/Process whereby digital objects are evaluated with the relevant FAIR metrics and assessment tools.	[YLF, VDA, KH]	Kristina Hettne|Victoria Dominguez Del Angel|Yann Le Franc								
obo:T4FS_0000126	assessment	data stewardship activity			https://orcid.org/0000-0002-7702-4495|Angus Whyte|Celia van Gelder|Mateusz Kuzak|Yan Wang						AL 17.3.22: Updated to "Assessment" to match the style of its sibling classes. AL 3.22: Was "govern and assess", which is a compound concept. Split into two classes, Assess and Governance. Original source: FAIR4S defined activity.		
obo:T4FS_0000049	audit	assessment	Evaluation of an organisation, system, group, project or product with respect to its data and processes around this, often in accordance with a standard, guide, or framework used to structure the work. This can involve assessing, describing, and classifying any data held. An audit can be carried out internally by those who have access to the data or participate in related processes regularly, or by an independent, external actor. 	RDMT. https://terms.codata.org/rdmt/audit	https://orcid.org/0000-0003-2687-1982|https://orcid.org/0000-0002-5214-4466								
obo:T4FS_0000270	authentication	information security	The process of confirming the identity of a principal entity.	Definition from now-deprecated CASRAI Glossary: authentication	https://orcid.org/0000-0003-2687-1982|https://orcid.org/0000-0002-5214-4466								
obo:T4FS_0000219	authenticity metadata	'contributes to the implementation of' some 'I1. (meta)data use a formal, accessible, shared, and broadly applicable language for knowledge representation'|data stewardship technical concept	Type of metadata that conveys information needed to link a data object to its original source. 	RDMT. https://terms.codata.org/rdmt/authenticity-metadata	https://orcid.org/0000-0003-2687-1982|https://orcid.org/0000-0002-5214-4466								
obo:T4FS_0000142	authorisation management	resource management	Authorization management is concerned with people's access to different objects, most often to data or physical objects, such as land, buildings, rooms or infrastructure.	https://managementmania.com/en/authorization-management	Kristina Hettne|Leighton Christiansen|Simon Hodson|Victoria Dominguez Del Angel								
obo:T4FS_0000251	big data	data	Voluminous amount of structured, semi-structured and/or unstructured data that have the potential to be mined for information, primarily characterised by big volume, extensive variety, high velocity (creation and use), and/or variability that together require a scalable architecture for efficient data storage, manipulation, and analysis. The definition is evolving and can vary by sector, depending on what kind of software tools are commonly available and what sizes of datasets are common in a particular discipline. With those caveats, big data in many sectors today will range from a few dozen terabytes to multiple petabytes.	RDMT. https://terms.codata.org/rdmt/big-data	https://orcid.org/0000-0003-2687-1982|https://orcid.org/0000-0002-5214-4466								
obo:T4FS_0000305	book	learning medium			https://orcid.org/0000-0003-2687-1982				https://orcid.org/0000-0003-2687-1982	2020-10-01T20:54:08.535183Z			
obo:T4FS_0000432	book chapter	book							https://orcid.org/0000-0003-2687-1982	2020-10-01T20:53:37.24517Z			
obo:T4FS_0000373	canonical data collection	data stewardship technical concept	Data collection that has been normalised by some established criteria to allow for effective data management. Examples include: data files that belong to a certain experiment, all files that are created by one specific simulation, all files that belong to a specific observation (same day, same place, etc.). 	RDMT. https://terms.codata.org/rdmt/canonical-data-collection	https://orcid.org/0000-0003-2687-1982|https://orcid.org/0000-0002-5214-4466								
obo:T4FS_0000425	catalogue	data stewardship technical concept	A type of collection that describes, and points to features of another collection.	RDMT. https://terms.codata.org/rdmt/catalogue	https://orcid.org/0000-0003-2687-1982|https://orcid.org/0000-0002-5214-4466								
obo:T4FS_0000070	cataloguing	curation	An intellectual process of describing objects in accordance with accepted library principles, particularly those of subject and classification order.	RDMT. https://terms.codata.org/rdmt/catalogue-verb	https://orcid.org/0000-0003-2687-1982|https://orcid.org/0000-0002-5214-4466								
obo:T4FS_0000411	change management	resource management	Change management is a broad subject and can be applied to all different types of organizational change. The most common change drivers include:  technological evolution, process reviews, crisis, and consumer habit changes; pressure from new business entrants, acquisitions, mergers, and organizational restructuring.	https://www.hucmi.com/en/hcmbok/	Kristina Hettne|Leighton Christiansen|Simon Hodson|Victoria Dominguez Del Angel	CM							
obo:T4FS_0000401	choosing the appropriate model or format for your data	('competency gained through' some ('learning medium' and ('supports implementation of' some 'I1. (meta)data use a formal, accessible, shared, and broadly applicable language for knowledge representation')))|fair evaluation of repositories for data deposition	To be able to choose the correct data model and/or exchange format for your data, based on the repository where you plan to deposit your data.	[PMQ]	https://orcid.org/0000-0003-2687-1982	Which data model to use|Which format to use							
obo:T4FS_0000011	choosing the appropriate reporting guideline for your data	('competency gained through' some ('learning medium' and ('supports implementation of' some 'I1. (meta)data use a formal, accessible, shared, and broadly applicable language for knowledge representation')))|('competency gained through' some ('learning medium' and ('supports implementation of' some 'I3. (meta)data include qualified references to other (meta)data')))|fair evaluation of repositories for data deposition	To be able to choose the appropriate reporting guideline/checklist for your data, based on community-adopted standards.	[PMQ]	https://orcid.org/0000-0003-2687-1982								
obo:T4FS_0000294	choosing the appropriate terminology for your data	fair evaluation of repositories for data deposition	To be able to research and identify the appropriate taxonomy for your project. This may involve using resources such as FAIRsharing, which captures metadata on taxonomies and provides an assessment of their FAIRness.	[PMQ]	https://orcid.org/0000-0003-2687-1982	Controlled Vocabulary identification|Ontology identification|Taxonomy identification|Thesaurus identification							
obo:T4FS_0000250	citable data	'contributes to the implementation of' some 'F1. (meta)data are assigned a globally unique and persistent identifier'|data	Standalone dataset that can be cited in a similar manner to other research outputs. The dataset appears in a data repository, data paper or project website, and has a Persistent Identifier. Most current referencing systems provide a format for citing datasets. 	RDMT. https://terms.codata.org/rdmt/citable-data	https://orcid.org/0000-0003-2687-1982|https://orcid.org/0000-0002-5214-4466								
obo:T4FS_0000133	cite contributions	('competency gained through' some ('learning medium' and ('supports implementation of' some 'F1. (meta)data are assigned a globally unique and persistent identifier')))|('competency gained through' some ('learning medium' and ('supports implementation of' some 'F3. metadata clearly and explicitly include the identifier of the data they describe')))|exposing data	Cite contributions to data work in published literature which draws upon that data.	[LM]	Laura Molloy|https://orcid.org/0000-0003-2687-1982								
obo:T4FS_0000271	cloud computing	data stewardship technical concept	Large-scale distributed computing paradigm that is driven by economies of scale, in which a pool of abstracted, virtualised, dynamically-scalable, managed computing power, storage, platforms and services are delivered on demand to external customers over the Internet. Key features are that: it is a specialised distributed computing paradigm; it is massively scalable; it can be encapsulated as an abstract entity that delivers different levels of services to customers outside the Cloud; it is driven by economies of scale; and the services can be dynamically configured (via virtualisation or other approaches) and delivered on demand. 	RDMT. https://terms.codata.org/rdmt/cloud-computing	https://orcid.org/0000-0003-2687-1982|https://orcid.org/0000-0002-5214-4466								
obo:T4FS_0000479	cloud computing environment management	resource management	The activity of bringing computer system resources, especially data storage and computing power on demand via Internet.	(modified from wikipedia) [VDA]	Kristina Hettne|Simon Hodson|Victoria Dominguez Del Angel								
obo:T4FS_0000146	cloud ecosystem	data stewardship technical concept	Ecosystem that includes software, infrastructure, consultants, integrators, partners, third parties and anything else in the specified environment that has a bearing on the other components. 	RDMT. https://terms.codata.org/rdmt/cloud-ecosystem	https://orcid.org/0000-0003-2687-1982|https://orcid.org/0000-0002-5214-4466								
obo:T4FS_0000287	collection management identification	data stewardship technical concept	Type of data provenance indication that adds metadata to identify data collections. The organisation doing the collection management is stated in the metadata along with the provenance of collection management events such as source of data acquisition, conservation, and movement. 	RDMT. https://terms.codata.org/rdmt/collection-management-identification	https://orcid.org/0000-0003-2687-1982|https://orcid.org/0000-0002-5214-4466								
obo:T4FS_0000528	comma separated values	'contributes to the implementation of' some 'I1. (meta)data use a formal, accessible, shared, and broadly applicable language for knowledge representation'|data stewardship technical concept	Values in a table presented as a series of ASCII text lines organised so that each column value is separated by a comma from the next column’s value and each row starts a new line. Along with pipe- and tab-separated values, comma-separated values are a specific example of a record-oriented data structure (usually of fixed dimension) with fields separated by an agreed delimiter. 	RDMT. https://terms.codata.org/rdmt/comma-separated-values	https://orcid.org/0000-0003-2687-1982|https://orcid.org/0000-0002-5214-4466	CSV					Maybe remove as shouldn't have formats here.		
obo:T4FS_0000249	community building	project management activities			https://orcid.org/0000-0002-7702-4495|https://orcid.org/0000-0003-2687-1982|Philippe Rocca-Serra|Susanna Sansone						AL 9.3.22: renamed to prevent compound term. Was 'Influencing/community building'		
obo:T4FS_0000475	computer code	data stewardship technical concept	A series of computer instructions written in some human readable computer language, usually stored in a text file.	Definition from now-deprecated CASRAI Glossary term: computer-code	https://orcid.org/0000-0003-2687-1982|https://orcid.org/0000-0002-5214-4466								
obo:T4FS_0000079	conducting operations	project management activities			https://orcid.org/0000-0002-7702-4495|https://orcid.org/0000-0003-2687-1982|Philippe Rocca-Serra|Susanna Sansone								
obo:T4FS_0000552	confidential information	data stewardship technical concept	Any information obtained by a person on the understanding that they will not disclose it to others, or obtained in circumstances where it is expected that they will not disclose it.	Definition from now-deprecated CASRAI Glossary term: confidential-information	https://orcid.org/0000-0003-2687-1982|https://orcid.org/0000-0002-5214-4466								
obo:T4FS_0000227	confidentiality	data stewardship technical concept	Duty and practice of ensuring that personal or sensitive information only flows from one entity to another according to legislated or otherwise broadly accepted norms and policies. This can be done by either restricting access to the data or certain variables in the data, and/or by protecting personal or sensitive information using an anonymisation method.	RDMT. https://terms.codata.org/rdmt/confidentiality	https://orcid.org/0000-0003-2687-1982|https://orcid.org/0000-0002-5214-4466								
obo:T4FS_0000275	conformance	data stewardship technical concept	Satisfaction of the requirements of a specific standard(s) and/or specification(s). Conformance is used with respect to voluntary standards and specifications, whereas compliance is used with respect to mandatory standards and regulations. 	RDMT. https://terms.codata.org/rdmt/conformance	https://orcid.org/0000-0003-2687-1982|https://orcid.org/0000-0002-5214-4466								
obo:T4FS_0000168	consensus standard	'contributes to the implementation of' some 'I1. (meta)data use a formal, accessible, shared, and broadly applicable language for knowledge representation'|data stewardship technical concept	A standard developed through the cooperation of all parties who have an interest in participating in its development and/or use.	Definition from now-deprecated CASRAI Glossary term: consensus-standard	https://orcid.org/0000-0003-2687-1982|https://orcid.org/0000-0002-5214-4466	Community standard							
BFO:0000002	continuant												
obo:T4FS_0000335	controlled vocabulary	'contributes to the implementation of' some 'I3. (meta)data include qualified references to other (meta)data'|data stewardship technical concept	List of standardised terminology, words, or phrases, used for indexing or content analysis and information retrieval, usually in a defined information domain.	RDMT. https://terms.codata.org/rdmt/controlled-vocabulary	https://orcid.org/0000-0003-2687-1982|https://orcid.org/0000-0002-5214-4466								
