ID	LABEL	Parent	IAO:0000115	IAO:0000119	IAO:0000117	IAO:0000118	obo:T4FS_0000564	obo:T4FS_0000565	oboInOwl:created_by	oboInOwl:creation_date	rdfs:comment	owl:deprecated	obo:IAO_0000233
obo:T4FS_0000065	data modeling	curation	Formalising and documenting existing processes and events. A first step in analysing a system of objects with which users interact is to identify each object and its relationship to other objects. This process is called data modelling and results in a picture of object relationships. Data modellers often use multiple models to view the same data and ensure that all processes, entities, relationships and data flows have been identified. There are several different approaches to data modelling, including: Conceptual Data Modelling (identifies the highest-level relationships between different entities); Enterprise Data Modelling (similar to conceptual data modelling, but addresses the unique requirements of a specific organisation); Logical Data Modelling (illustrates the specific entities, attributes and relationships involved in a business function. Serves as the basis for the creation of the physical data model); Physical Data Modelling (represents an application and database-specific implementation of a logical data model).	RDMT. https://terms.codata.org/rdmt/data-modelling	https://orcid.org/0000-0003-2687-1982|https://orcid.org/0000-0002-5214-4466								
obo:T4FS_0000013	data munging	curation	A series of potentially destructive or irrevocable changes to a piece of data or a file. Common munging operations include removing punctuation or html tags, data parsing, filtering, and transformation.	Definition from now-deprecated CASRAI Glossary term: data-munging	https://orcid.org/0000-0003-2687-1982|https://orcid.org/0000-0002-5214-4466								
obo:T4FS_0000045	data organization	'contributes to the implementation of' some 'fair principle'|data stewardship technical concept	Set of measures that are used by a repository to form aggregations of data objects (including collections and metadata) to describe the properties of data objects, to register PIDs, to build the PID records, to link between all components, and to set up the containers (in the form of the software stack) that are used to store all components.	RDMT. https://terms.codata.org/rdmt/data-organisation	https://orcid.org/0000-0003-2687-1982|https://orcid.org/0000-0002-5214-4466								
obo:T4FS_0000333	data policy	'contributes to the implementation of' some 'fair principle'|data stewardship technical concept	Set of high-level principles that establish a guiding framework for data-related issues. A data policy may contain subsidiary sections that define approaches to strategic aspects such as data access; data protection; data management, custodianship or stewardship; data preservation; relevant legal matters; data acquisition; data ethics and other data-related issues. Distinct from a data management policy which is the subset of data policy addressing the management of a specified set of data assets.	RDMT. https://terms.codata.org/rdmt/data-policy	https://orcid.org/0000-0003-2687-1982|https://orcid.org/0000-0002-5214-4466								
obo:T4FS_0000044	data processing	curation	Generic concept referring to all kinds of procedures being executed on data at any point in the data lifecycle.	RDMT. https://terms.codata.org/rdmt/data-processing	https://orcid.org/0000-0003-2687-1982|https://orcid.org/0000-0002-5214-4466								
obo:T4FS_0000108	data production	data acquisition	All activities involved in the planning, collecting, processing, analysis and maintenance of data in the original research project. Among these activities are selecting a study design, constructing instruments for data collection, conducting data collection/creation, performing data editing/verification/validation, analysing data, backing up data versions and preparing and tagging metadata.	RDMT. https://terms.codata.org/rdmt/data-production	https://orcid.org/0000-0003-2687-1982|https://orcid.org/0000-0002-5214-4466								
obo:T4FS_0000516	data profiling	data analysis	Statistical analysis and assessment of the quality of data values within a dataset for consistency, uniqueness and logic. The data profiling process cannot identify inaccurate data; it can only identify rule violations and anomalies. The insight gained by data profiling can be used to determine how difficult it will be to use existing data for other purposes. It can also be used to provide metrics to assess data quality and help determine whether or not metadata accurately describes the source data. Profiling tools evaluate the actual content, structure and quality of the data by exploring relationships that exist between value collections both within and across datasets.	RDMT. https://terms.codata.org/rdmt/data-profiling	https://orcid.org/0000-0003-2687-1982|https://orcid.org/0000-0002-5214-4466								
obo:T4FS_0000247	data publication	exposing data	Release of research data, associated metadata, accompanying documentation, and software code (in cases where the raw data have been processed or manipulated) for re-use and analysis in such a manner that they can be discovered on the Web and referred to in a unique and persistent way. Data publication occurs via dedicated data repositories and/or (data) journals which ensure that the published research objects are findable, accessible, interoperable and re-usable.	RDMT. https://terms.codata.org/rdmt/data-publication	https://orcid.org/0000-0003-2687-1982|https://orcid.org/0000-0002-5214-4466								
obo:T4FS_0000507	data quality	data stewardship technical concept	Reliability and application efficiency of data. Perception or assessment of a dataset's fitness to serve its purpose in a given context. Aspects of data quality include: Accuracy, Completeness, Update status, Relevance, Consistency across data sources, Reliability, Appropriate presentation, Accessibility. Data quality is affected by the way data are entered, stored and managed. Maintaining data quality requires going through the data periodically and scrubbing it. Typically this involves updating, standardising, and de-duplicating records to create a single view of the data, even if it is stored in multiple disparate systems.	RDMT. https://terms.codata.org/rdmt/data-quality	https://orcid.org/0000-0003-2687-1982|https://orcid.org/0000-0002-5214-4466								
obo:T4FS_0000173	data recovery	archiving	The process of restoring data that have been lost, accidentally deleted, corrupted or made inaccessible for any reason. The data recovery process may vary, depending on the circumstances of the data loss, the data recovery software used to create backups, and backup target media. In some cases, end users may be able to restore lost...	Definition from now-deprecated CASRAI Glossary term: data-quality-review	https://orcid.org/0000-0003-2687-1982|https://orcid.org/0000-0002-5214-4466								
obo:T4FS_0000392	data reduction	data management	Process of reducing the amount or size of stored data. This may be achieved by eliminating redundant copies of data files, deduplicating data files by removing redundant records, or by compressing the data files.	RDMT. https://terms.codata.org/rdmt/data-reduction	https://orcid.org/0000-0003-2687-1982|https://orcid.org/0000-0002-5214-4466								
obo:T4FS_0000496	data reference model	data model	A framework whose primary purpose is to enable information sharing and reuse via the standard description and discovery of common data and the promotion of uniform data management practices.	Definition from now-deprecated CASRAI Glossary: data-reference-model	https://orcid.org/0000-0003-2687-1982|https://orcid.org/0000-0002-5214-4466								
obo:T4FS_0000019	data registration	exposing data	Curation process on a data object by which it receives a persistent identifier (PID) from a trusted registration authority. Registration must be accompanied by the step(s) to create and submit metadata describing the object to the registry.	RDMT. https://terms.codata.org/rdmt/data-registration	https://orcid.org/0000-0002-7702-4495|https://orcid.org/0000-0003-2687-1982|https://orcid.org/0000-0002-5214-4466								
obo:T4FS_0000544	data repository management	resource management	Management of a national, discipline or institutional repository of published datasets. Provision of infrastructure, curation, policy and training that govern the organisation, control, and properties of the repository such as: required file formats, access control restrictions, integrity, replication, retention, disposal, etc.	RDMT. https://terms.codata.org/rdmt/data-repository-management	https://orcid.org/0000-0002-7702-4495|https://orcid.org/0000-0003-2687-1982|https://orcid.org/0000-0002-5214-4466								
obo:T4FS_0000326	data representation	curation	Object describing the context of the data, including provenance, description, structural, and administrative information.	RDMT. https://terms.codata.org/rdmt/data-representation	https://orcid.org/0000-0002-7702-4495|https://orcid.org/0000-0003-2687-1982|https://orcid.org/0000-0002-5214-4466								
obo:T4FS_0000046	data rescue	archiving	Recovery and/or transformation and digitization of dark data and at-risk data so that they can be preserved, accessed, shared, and used. Data rescue also involves the addition of rich metadata to make the content understandable and more easily re-usable.	RDMT. https://terms.codata.org/rdmt/data-rescue	https://orcid.org/0000-0002-7702-4495|https://orcid.org/0000-0003-2687-1982|https://orcid.org/0000-0002-5214-4466								
obo:T4FS_0000330	data residency	data stewardship activity	Physical or geographic location of an organisation’s data or information. Data residency also refers to the legal or regulatory requirements imposed on data based on the country or region in which it resides. Cloud computing, which allows organisations to deliver hosted services over the Internet, can create data residency concerns.	RDMT. https://terms.codata.org/rdmt/data-residency	https://orcid.org/0000-0003-2687-1982|https://orcid.org/0000-0002-5214-4466								
obo:T4FS_0000324	data retention policy	data stewardship technical concept	Established protocol of an organisation for retaining information for operational or regulatory compliance needs. The objectives of a data retention policy are to keep important information for future use or reference, to organise information so it can be searched and accessed at a later date, and to dispose of information that is no longer needed. A data retention policy must consider both the value of data over time, and regulations to which the data may be subject.	RDMT. https://terms.codata.org/rdmt/data-retention-policy	https://orcid.org/0000-0003-2687-1982|https://orcid.org/0000-0002-5214-4466								
obo:T4FS_0000406	data review	data analysis	Activity through which the correctness conditions of the data are verified. It also includes the specification of the type of the error or condition not met, and the qualification of the data and its division into “error-free” or “erroneous” data. Data review consists of both error detection and data analysis, and can be carried out in manual or automated mode.	RDMT. https://terms.codata.org/rdmt/data-review	https://orcid.org/0000-0002-7702-4495|https://orcid.org/0000-0003-2687-1982|https://orcid.org/0000-0002-5214-4466								
obo:T4FS_0000522	data scaling	data analysis	Techniques used to deal with parameters having different units and scales.	RDMT. https://terms.codata.org/rdmt/data-scaling	https://orcid.org/0000-0002-7702-4495|https://orcid.org/0000-0003-2687-1982|https://orcid.org/0000-0002-5214-4466	Data rescaling							
obo:TF4S_0000566	data scientist	scientist			https://orcid.org/0000-0002-7702-4495						AL 15.3.22: Added for FAIR Cookbook integration.		
obo:T4FS_0000074	data selection	data acquisition	Process that creates a new dataset from an original source.	RDMT. https://terms.codata.org/rdmt/data-selection	https://orcid.org/0000-0002-7702-4495|https://orcid.org/0000-0003-2687-1982|https://orcid.org/0000-0002-5214-4466								
obo:T4FS_0000482	data sharing	exposing data	Practice of making data available for checking, reproducing or reusing. The mechanisms available for achieving this are: making data available on request, as supplementary information to journal articles, or as published datasets in data repositories.	RDMT. https://terms.codata.org/rdmt/data-sharing	https://orcid.org/0000-0002-7702-4495|https://orcid.org/0000-0003-2687-1982|https://orcid.org/0000-0002-5214-4466	Data dissemination|Data posting							
obo:T4FS_0000057	data splitting	information security	Protecting sensitive data from unauthorised access by encrypting the data and storing different portions of a file on different servers. An unauthorised person would need to know the locations of the servers containing the parts, be able to get access to each server, know what data to combine, and how to decrypt it. Data splitting can be made even more effective by periodically retrieving and recombining the parts, and then splitting the data in a different way among different servers, and using a different encryption key.	RDMT. https://terms.codata.org/rdmt/data-splitting	https://orcid.org/0000-0002-7702-4495|https://orcid.org/0000-0003-2687-1982|https://orcid.org/0000-0002-5214-4466								
obo:T4FS_0000263	data standardization	data stewardship activity	Conversion of multiple datasets to a single common format and structure.	RDMT. https://terms.codata.org/rdmt/data-standardisation	https://orcid.org/0000-0003-2687-1982|https://orcid.org/0000-0002-5214-4466								https://github.com/terms4fairskills/FAIRterminology/issues/32
obo:T4FS_0000178	data steward	'has/wants competency in' some 'fair stewardship training'|'has/wants competency in' some 'research data management'|'has/wants competency in' some 'understanding persistent identifiers'|role	Data steward is an umbrella term for numerous support roles that involve the creation, management and usage of research data. A data steward facilitates the quality, integrity and access to (meta)data in a manner that is consistent with the appropriate laws and institutional policies, ensuring professional treatment of data throughout all stages of the research project.	The Turing Way. https://book.the-turing-way.org/collaboration/research-infrastructure-roles/data-steward.html	https://orcid.org/0000-0003-2687-1982|https://orcid.org/0000-0002-5214-4466				https://orcid.org/0000-0003-2687-1982				
obo:T4FS_0000012	data stewardship activity	'process'|'requires/improves personal attribute' some 'data stewardship soft skill'	A specific deed, action, function or sphere of action in relation with the role of data stewardship		https://orcid.org/0000-0002-7702-4495|https://orcid.org/0000-0003-2687-1982|Yann Le Franc		Set of actions carried out during data stewardship processes						
obo:T4FS_0000446	data stewardship guideline	'information content entity'			Yann Le Franc				ylefranc	2021-03-17T16:34:14.943152Z			
obo:T4FS_0000548	data stewardship soft skill	'realizable entity'	The personal attributes necessary to perform a task.		https://orcid.org/0000-0003-2687-1982		Aptitude is the innate trait or talent that a person brings to a task or situation. It is the quality of being able to do something. An aptitude is not something that can be learned or developed unless it is there to begin with.	Laura Molloy, Celia van Gelder:https://docs.google.com/presentation/d/12oNBFix39ZtsLAR4tkqESBXxMU5rVg3cCKoEDG2oK-M/edit#slide=id.p5					
obo:T4FS_0000372	data stewardship technical concept	'information content entity'|'contributes to the implementation of' some 'data stewardship guideline'			https://orcid.org/0000-0002-7702-4495|https://orcid.org/0000-0003-2687-1982								
obo:T4FS_0000215	data store	data stewardship technical concept	Repository for persistently storing collections of data, such as a database, a file system or a directory. The data stored can be of any type that can be rendered in digital format and placed in electronic media.	RDMT. https://terms.codata.org/rdmt/data-store	https://orcid.org/0000-0003-2687-1982|https://orcid.org/0000-0002-5214-4466								
obo:T4FS_0000201	data stream	data stewardship technical concept	Sequence of digitally encoded, coherent signals used to send or receive a representation of information content as transmitted.	RDMT. https://terms.codata.org/rdmt/data-stream	https://orcid.org/0000-0003-2687-1982|https://orcid.org/0000-0002-5214-4466								
obo:T4FS_0000154	data structure	data stewardship technical concept	Specialised format for organising and storing data. General data structure types include the array, the file, the record, the table, the tree, and so on. Any data structure is designed to organise data to suit a specific purpose so that it can be accessed and worked with in appropriate ways. In computer programming, a data structure may be selected or designed to store data for the purpose of working on it with various algorithms.	RDMT. https://terms.codata.org/rdmt/data-structure	https://orcid.org/0000-0003-2687-1982|https://orcid.org/0000-0002-5214-4466	Data format							
obo:T4FS_0000428	data structure continuum	data stewardship technical concept	Continuum of data structure that includes unstructured data, semi-structured data, and structured data.	RDMT. https://terms.codata.org/rdmt/data-structure-continuum	https://orcid.org/0000-0003-2687-1982|https://orcid.org/0000-0002-5214-4466								
obo:T4FS_0000166	data table attribute (field)	data stewardship technical concept	Field or column in a database table. It is an abbreviation for ‘physical data attribute’ which is a single data element related to a data object, such as a table in a database. The database schema associates one or more attributes with each database entity (i.e. table).	RDMT. https://terms.codata.org/rdmt/data-table-attribute-field	https://orcid.org/0000-0003-2687-1982|https://orcid.org/0000-0002-5214-4466								
obo:T4FS_0000342	data traceability	data stewardship technical concept	Data traceability follows the lifecycle of data to track all access and changes to the data. It helps demonstrate transparency, compliance and adherence to regulations. Data traceability, along with data compliance, can be considered part of a data audit process. Data traceability is fundamental to reproducible research.	RDMT. https://terms.codata.org/rdmt/data-traceability	https://orcid.org/0000-0003-2687-1982|https://orcid.org/0000-0002-5214-4466								
obo:T4FS_0000069	data transformation	data analysis	Manipulation of raw data to produce a single output.	RDMT. https://terms.codata.org/rdmt/data-transformation	https://orcid.org/0000-0002-7702-4495|https://orcid.org/0000-0003-2687-1982|https://orcid.org/0000-0002-5214-4466								
obo:T4FS_0000394	data type registry	data store	Registry for data types supporting their standardisation, uniqueness and discoverability. Data types range from complex digital objects to simple categories that occur in digital objects. An additional functionality may be to link data types to executable data processing functions.	RDMT. https://terms.codata.org/rdmt/data-type-registry	https://orcid.org/0000-0003-2687-1982|https://orcid.org/0000-0002-5214-4466								
obo:T4FS_0000493	data upload database	data store	Collection of interrelated data often with controlled redundancy, organised according to a scheme to serve one or more applications; the data are stored so that they can be used by several programs without concern for data structures or organisation.	RDMT. https://terms.codata.org/rdmt/data-upload-database	https://orcid.org/0000-0003-2687-1982|https://orcid.org/0000-0002-5214-4466								
obo:T4FS_0000238	data validation	curation	Checks that data are valid, sensible, reasonable, clean, usable, and secure before they are processed. Provides well-defined guarantees for fitness, accuracy, and consistency for any of various kinds of user input into an application or automated system. Failures or omissions in data validation can lead to data corruption, security vulnerability. Improperly validated data can cause computer code processing the data to crash, generate error messages, behave in an unanticipated manner, or generate incorrect results that may be difficult or impossible to detect.	RDMT. https://terms.codata.org/rdmt/data-validation	https://orcid.org/0000-0003-2687-1982|https://orcid.org/0000-0002-5214-4466								
obo:T4FS_0000054	data warehouse	data store	Central repository for all or significant parts of the data that an organisation’s various business systems collect, containing harmonised, highly-structured, quality data integrated from multiple sources. Data warehousing emphasises the capture of data from diverse sources for useful analysis and access, but does not generally start from the point-of-view of the end user who may need access to specialised data marts. There are two approaches to data warehousing: The top-down approach spins off data marts for specific groups of users after the complete data warehouse has been created. The bottom-up approach builds the data marts first and then combines them into a single, all-encompassing data warehouse.	RDMT. https://terms.codata.org/rdmt/data-warehouse	https://orcid.org/0000-0003-2687-1982|https://orcid.org/0000-0002-5214-4466								
obo:T4FS_0000291	data wrangling	curation	Manually or semi-automatically converting or mapping data from one form into another format that allows for more convenient consumption of the data with the help of semi-automated tools. Gathering and organising disparate data from different sources, often collected by many different investigators. Activities include developing and supporting search tools that utilise standardised metadata, harmonising the coding of data for specific variables, engineering new methods of combining data. with the help of semi-automated tools. The result of data wrangling is repurposed data.	RDMT. https://terms.codata.org/rdmt/data-wrangling	https://orcid.org/0000-0003-2687-1982|https://orcid.org/0000-0002-5214-4466								
obo:T4FS_0000397	database	data store	Collection of data that is organised according to a conceptual structure/model describing the characteristics of these data and the relationships among their corresponding entities, supporting one or more application areas. A database allows its contents to be easily accessed, managed and updated. The type of database used depends on the requirements of the study. A common type is the relational database, where data are related to each other in a systematic manner so that they can be reorganised and accessed in a number of different ways. A database may house one or many datasets.	RDMT. https://terms.codata.org/rdmt/database	https://orcid.org/0000-0003-2687-1982|https://orcid.org/0000-0002-5214-4466								
obo:T4FS_0000151	database administration	data management	Managing the physical aspects of data resources, including database design and integrity, backup and recovery, performance and tuning.	RDMT. https://terms.codata.org/rdmt/database-administration	https://orcid.org/0000-0002-7702-4495|https://orcid.org/0000-0003-2687-1982|https://orcid.org/0000-0002-5214-4466								
obo:T4FS_0000034	database developer	role											
obo:T4FS_0000347	dataset	dataset series	Organised collection of data or objects in a computational format, that are generated or collected by researchers in the course of their investigations, regardless of their form or method, that form the object on which researchers test a hypothesis. This includes the full range of data: raw, unprocessed datasets, proprietary generated and processed data and secondary data obtained from third parties. The presentation of the data in the application is enabled through metadata.	RDMT. https://terms.codata.org/rdmt/dataset	https://orcid.org/0000-0003-2687-1982|https://orcid.org/0000-0002-5214-4466								
obo:T4FS_0000072	dataset series	database	Collection of datasets sharing the same product specification. A dataset series is a type of aggregation or collection with some “logical grouping” such as by a topic (specification) with the (product) unit being a dataset series.	RDMT. https://terms.codata.org/rdmt/dataset-series	https://orcid.org/0000-0003-2687-1982|https://orcid.org/0000-0002-5214-4466								
obo:T4FS_0000024	de facto standard	'contributes to the implementation of' some 'I1. (meta)data use a formal, accessible, shared, and broadly applicable language for knowledge representation'|data stewardship technical concept	A standard that is widely accepted and used, but lacks formal approval by a recognized standards developing organization (e.g., the QWERTY keyboard).	Definition from now-deprecated CASRAI Glossary term: de-facto-standard	https://orcid.org/0000-0003-2687-1982|https://orcid.org/0000-0002-5214-4466								
obo:T4FS_0000501	de-anonymization	information security	Reverse engineering process in which de-identified data are cross-referenced with other data sources to re-identify the personally identifiable information. This could occur if a de-identification process had not been not successfully performed, or had not been undertaken in the first place.	RDMT. https://terms.codata.org/rdmt/de-anonymisation	https://orcid.org/0000-0002-7702-4495|https://orcid.org/0000-0003-2687-1982|https://orcid.org/0000-0002-5214-4466								
