ID	LABEL	Parent	IAO:0000115	IAO:0000119	IAO:0000117	IAO:0000118	obo:T4FS_0000564	obo:T4FS_0000565	oboInOwl:created_by	oboInOwl:creation_date	rdfs:comment	owl:deprecated	obo:IAO_0000233
obo:T4FS_0000365	pid domain	'contributes to the implementation of' some 'F1. (meta)data are assigned a globally unique and persistent identifier'|persistent identifier	For a single identifier, the class of entity it refers to. For a PID system, the typical class of entities it is intended to be used for. Examples include: digital objects, physical objects, bodies, actors.	CASRAI. https://casrai.org/term/pid-domain/	https://orcid.org/0000-0002-7702-4495|Peter McQuilton								
obo:T4FS_0000239	pid record	'contributes to the implementation of' some 'F1. (meta)data are assigned a globally unique and persistent identifier'|persistent identifier	A type of record (and organization) that stores an instance of an executable/understandable PID. The content of a PID record distinguishes a registered digital or data object from other DOs. A PID record is a type of record that includes property information that characterizes the digital object it is identifying. Important parts of a PID record are location and checksum. However there is a large variation in usage. In some data models the PID is simply used as a unique label with an empty record. A PID record has a lifecycle including creation, publication, Curation and the destruction.	CASRAI, https://casrai.org/term/pid-record/	https://orcid.org/0000-0002-7702-4495|Peter McQuilton								
obo:T4FS_0000540	pid resolution	'contributes to the implementation of' some 'F1. (meta)data are assigned a globally unique and persistent identifier'|persistent identifier	The process of resolving a PID to a useful state of information about a digital object by using a globally available system.	CASRAI. https://casrai.org/term/pid-resolution/	https://orcid.org/0000-0002-7702-4495|Peter McQuilton								
obo:T4FS_0000139	pid service	'contributes to the implementation of' some 'F1. (meta)data are assigned a globally unique and persistent identifier'|persistent identifier	A service that provides a connection between a PID and its target object.	CASRAI. https://casrai.org/term/pid-service/	https://orcid.org/0000-0002-7702-4495|Peter McQuilton								
obo:T4FS_0000360	pid system	'contributes to the implementation of' some 'F1. (meta)data are assigned a globally unique and persistent identifier'|persistent identifier	Consists of at least one PID resolver, a name schema and a defined mechanism for issuing PIDs that conform to the name schema. Examples include: DOI, Handle System, URN, ARK, PURL, etc.	CASRAI. https://casrai.org/term/pid-system/	https://orcid.org/0000-0002-7702-4495|Peter McQuilton								
obo:T4FS_0000002	pipe separated values	'contributes to the implementation of' some 'I1. (meta)data use a formal, accessible, shared, and broadly applicable language for knowledge representation'|data stewardship technical concept	A file that contains the values in a table as a series of ASCII text lines organized so that each column value is separated by a pipe.	CASRAI. https://casrai.org/term/pipe-separated-values/	https://orcid.org/0000-0002-7702-4495|Peter McQuilton								
obo:T4FS_0000211	presentation slides	learning medium			Peter McQuilton				Peter McQuilton	2020-10-01T20:52:43.543314Z			
obo:T4FS_0000421	presentation slides with interactive exercises	presentation slides							Peter McQuilton	2020-11-16T22:18:14.764875Z			
obo:T4FS_0000017	preservation	archiving	An activity within archiving in which specific items of data are maintained over time so that they can still be accessed and understood through changes in technology.	CASRAI. https://casrai.org/term/preservation/	https://orcid.org/0000-0002-7702-4495|Peter McQuilton	Conservation							
obo:T4FS_0000104	preservation costs management	resource management	Planning for and controlling the present and future costs of the conservation of data, including technical storage, fixed costs, and staff resources.	Based on https://www.cessda.eu/About/Projects/Past-projects/CESSDA-SaW/WP4/Cost-Benefit-Advocacy-Toolkit/Costs-Factsheet [LLC]	Kristina Hettne|Leighton Christiansen|Simon Hodson|Victoria Dominguez Del Angel								
obo:T4FS_0000410	preservation metadata	'contributes to the implementation of' some 'F2. data are described with rich metadata'|metadata	Documents actions that have been undertaken to preserve a digital resource such as migrations and checks sum calculations.	CASRAI. https://casrai.org/term/preservation-metadata/	https://orcid.org/0000-0002-7702-4495|Peter McQuilton								
obo:T4FS_0000441	principal investigator	manager	The Principal Investigator (P.I.) is a researcher who has a research leadership role and is the point of contact for a project or partnership that applies the scientific method, historical method, or other research methodology for the advancement of knowledge resulting in independent, objective, high quality, traceable, and reproducible results. The P.I. has primary responsibility for the intellectual direction and integrity of the research or research-related activity, including data production, findings and results, and ensures ethical conduct in all aspects of the research process including but not limited to the treatment of human and animal subjects, conflicts of interest, data acquisition, sharing and ownership, publication practices, responsible authorship, and collaborative research and reporting. While various tasks may be delegated to team members, some of whom may have greater expertise in specific areas, the P.I. is familiar with the various technical and scientific aspects of a project and how they fit together, is able to identify and remediate gaps, and ensure communication within the team and with users of the research data and results.	CASRAI. https://casrai.org/term/principal-investigator	https://orcid.org/0000-0002-7702-4495|Peter McQuilton								
obo:T4FS_0000524	privacy governance	governance	Monitoring the risk to privacy posed by data requests from researchers, and the practices of data custodians in providing data (information governance) to ensure that confidentiality is protected. Such governance requires specialized knowledge of technology, law, and statistical methods.	CASRAI. https://casrai.org/term/privacy-governance/	https://orcid.org/0000-0002-7702-4495|Peter McQuilton								
obo:T4FS_0000192	privacy-preserving data linkage	data stewardship technical concept	Data linkage where the resulting product has been de-identified.	CASRAI. https://casrai.org/term/privacy-preserving-data-linkage	https://orcid.org/0000-0002-7702-4495|Peter McQuilton								
BFO:0000015	process												
obo:TF4S_0000572	procurement officer	role			https://orcid.org/0000-0002-7702-4495						AL 16.3.22: Added as part of FAIR Cookbook integration. Useful for such roles to be able to understand the cost of e.g. making things FAIR (and how to deal with it), but also the benefits.		
obo:T4FS_0000203	program governance	governance	The process of developing, communicating, implementing, monitoring, and assuring the policies, procedures, organizational structures, and practices associated with a given program.	CASRAI. https://casrai.org/term/program-governance/	https://orcid.org/0000-0002-7702-4495|Peter McQuilton								
obo:T4FS_0000442	program manager	manager	The person responsible for creating the organizational environment culture by providing clear direction and circumstances that allow people to be successful. The program manager is judged on the elements time, cost, and scope, cumulatively for all the projects and operations within the program. Program management decisions are both tactical and strategic in nature. The strategy aspects of these decisions must consider multidimensional impacts beyond the near-term delivery dates of the project. In addition to delivery and execution, the program manager has to also be concerned with the overall health and effectiveness of the program over the long term.	CASRAI. https://casrai.org/term/program-manager	https://orcid.org/0000-0002-7702-4495|Peter McQuilton								
obo:T4FS_0000340	project lifecycle	data stewardship technical concept	Describes the processes and tasks that must be completed to produce a product or service. Different project lifecycles exist for specific products and services. (For example, the lifecycle followed to build a house is very different from the lifecycle followed to develop a software package.	CASRAI. https://casrai.org/term/project-lifecycle	https://orcid.org/0000-0002-7702-4495|Peter McQuilton								
obo:T4FS_0000323	project management	resource management	The practice of initiating, planning, executing, controlling, and closing the work of a team to achieve specific goals and meet specific success criteria at the specified time.	KH	Kristina Hettne|Simon Hodson|Victoria Dominguez Del Angel	PM							
obo:T4FS_0000320	project management activities	data stewardship activity	The practice of initiating, planning, executing, controlling, and closing the work of a team in relation to FAIR data stewardship.	PMQ	https://orcid.org/0000-0002-7702-4495|Peter McQuilton|Philippe Rocca-Serra|Susanna Sansone								
obo:T4FS_0000218	project management lifecycle	data stewardship technical concept	Defines how to manage a project. It will always be the same, regardless of the project lifecycle being employed.	CASRAI. https://casrai.org/term/project-management-lifecycle	https://orcid.org/0000-0002-7702-4495|Peter McQuilton								
obo:T4FS_0000105	project manager	manager	The person who is tasked with delivering a project within the boundaries and framework established by the program manager. The project manager is and should be delivery and execution focused and is judged on the elements of time, cost, and scope of the project. The person responsible for ensuring that the Project Team completes the project. The Project Manager develops the Project Plan with the team and manages the teamÃ­s performance of project tasks. It is also the responsibility of the Project Manager to secure acceptance and approval of deliverables from the Project Sponsor and Stakeholders. The Project Manager is responsible for communication, including status reporting, risk management, escalation of issues that cannot be resolved in the team, and, in general, making sure the project is delivered in budget, on schedule, and within scope.	CASRAI. https://casrai.org/term/project-manager	https://orcid.org/0000-0002-7702-4495|Peter McQuilton								
obo:T4FS_0000530	project team member	role	Responsible for executing tasks and producing deliverables as outlined in the Project Plan and directed by the Project Manager, at whatever level of effort or participation has been defined for them.	CASRAI. https://casrai.org/term/project-team-member	https://orcid.org/0000-0002-7702-4495|Peter McQuilton								
obo:T4FS_0000309	provenance	'contributes to the implementation of' some 'interoperability of digital assets'|data stewardship technical concept	A type of historical information or metadata about the origin, location or the source of something, or the history of the ownership or location of an object or resource including digital objects. For example, information about the Principal Investigator who recorded the data, and the information concerning its storage, handling, and migration.	CASRAI. https://casrai.org/term/provenance	https://orcid.org/0000-0002-7702-4495|Peter McQuilton								
obo:T4FS_0000368	provenance information management	resource management	The activity of recording provenance for data and software. Knowledge about provenance vocabularies, for example PROV-O and models provenance such as nanopublications.	KH	Kristina Hettne|Simon Hodson|Victoria Dominguez Del Angel								
obo:T4FS_0000402	provenance metadata	'contributes to the implementation of' some 'F2. data are described with rich metadata'|metadata	Information concerning the creation, attribution, or version history of managed data. Provenance metadata that indicates the relationship between two versions of data objects and is generated whenever a new version of a dataset is created. Examples include: (i) the name of the program that generated the new version, (ii) the commit id of the program.	CASRAI, https://casrai.org/term/provenance-metadata/	https://orcid.org/0000-0002-7702-4495								
obo:T4FS_0000106	publish data	exposing data			https://orcid.org/0000-0002-7702-4495|Celia van Gelder|Mateusz Kuzak|Peter McQuilton|Yan Wang	Release data					AL 9.3.22. Removed from 'FAIR4S defined activity' class to better integrate with the T4FS hierarchy. AL 5.5.22: removed "Publishing and archiving data" and "Publish and archive data" alternative terms, as the two actions are not the same.		
obo:T4FS_0000298	publish output in a repository	publish data	Deposit research output (software, data and publication together with documentation) in  previousy selected repositories.		Celia van Gelder|Mateusz Kuzak|Yan Wang								
obo:T4FS_0000153	quality assessment	assessment			Angus Whyte|Celia van Gelder|Mateusz Kuzak|Yan Wang								
obo:T4FS_0000174	R1. (meta)data are richly described with a plurality of accurate and relevant attributes	reuse of digital assets			Peter McQuilton								
obo:T4FS_0000200	R1.1 (meta)data are released with a clear and accessible data usage license	R1. (meta)data are richly described with a plurality of accurate and relevant attributes			Peter McQuilton	Data license							
obo:T4FS_0000385	R1.2 (meta)data are associated with detailed provenance	R1. (meta)data are richly described with a plurality of accurate and relevant attributes			Peter McQuilton								
obo:T4FS_0000391	R1.3 (meta)data meet domain-relevant community standards	R1. (meta)data are richly described with a plurality of accurate and relevant attributes			Peter McQuilton								
obo:T4FS_0000109	raw data	data	Data that have not been processed for meaningful use. Although raw data have the potential to become information, they require selective extraction, organization, and sometimes analysis and formatting for presentation. As a result of processing, raw data sometimes end up in a database, which enables the data to become accessible for further processing and analysis.	CASRAI. https://casrai.org/term/raw-data	https://orcid.org/0000-0002-7702-4495|Peter McQuilton								
obo:T4FS_0000121	re-use	Obsolete Class	OBSOLETE. Use of content outside of its original intention.	CASRAI. https://casrai.org/term/re-use	https://orcid.org/0000-0002-7702-4495|Peter McQuilton						AL 2.3.23: Removed because of its high level of similarity with the 'R' FAIR principle.	1	https://github.com/terms4fairskills/FAIRterminology/issues/15
obo:T4FS_0000026	real-time data	data	Data that are being received, processed and stored at the time of their occurrence with only small delays. Examples include: stock quotes, manufacturing statistics, Web server loads, data warehouse activity and sensor feeds to data collectors. Real-time data are data streams that are typically generated by sensors and received via direct networking connections.	CASRAI. https://casrai.org/term/real-time-data	https://orcid.org/0000-0002-7702-4495|Peter McQuilton								
obo:T4FS_0000183	recognise and acknowledge contributions	('competency gained through' some ('learning medium' and ('supports implementation of' some 'I3. (meta)data include qualified references to other (meta)data')))|exposing data	To clearly communicate the existence of contributions from different individuals / projects to the compilation of a given dataset, in such a way that can be consistently cited.	[LM]	Laura Molloy	attribution|credit							
obo:T4FS_0000500	record	data stewardship technical concept	1. A collection of data items arranged for processing by a program. Multiple records are contained in a file or dataset. Typically, records can be of fixed-length or be of variable length with the length information contained within the record. 2. A record (sometimes called a row) is a group of fields (sometimes called columns) within a table that are relevant to a specific entity.	CASRAI. https://casrai.org/term/record	https://orcid.org/0000-0002-7702-4495|Peter McQuilton								
obo:T4FS_0000301	record provenance information	'contributes to the implementation of' some 'F2. data are described with rich metadata'|metadata	Information for a data object that includes: * the person who deposited the data object in the repository, * the source of the data object, * the date when the object was deposited, and * authenticity information needed to link the data object to its original source.	CASRAI. https://casrai.org/term/record-provenance-information/	https://orcid.org/0000-0002-7702-4495|Peter McQuilton								
obo:T4FS_0000094	record standardization	data stewardship technical concept	A process in which files are first parsed (assigned to appropriate fields in a record) and then translated to a common format. For example, if an original record had the clientâ€™s name and address as â€œBob Jones, VP Acme. Co., 15 S. Main St, Brooklynâ€ the standardized record might read â€œBob Jones, Vice President, Acme Corporation, 15 South Main Street, Brooklyn, New Yorkâ€. Data often lack consistency simply because there are a many of ways of saying the same thing. Standardizing the record ensures that when a query is run for a particular field, accurate results will be returned.	CASRAI. https://casrai.org/term/record-standardization	https://orcid.org/0000-0002-7702-4495|Peter McQuilton								
obo:T4FS_0000081	reference model	'contributes to the implementation of' some 'I1. (meta)data use a formal, accessible, shared, and broadly applicable language for knowledge representation'|data stewardship technical concept	A design covering a class of frameworks with the following characteristics: (1) it can be used to generate more specific models that still belong to the class and (2) it can be used to compare a concrete framework design to identify whether it belongs to the same class.	CASRAI. https://casrai.org/term/reference-model	https://orcid.org/0000-0002-7702-4495|Peter McQuilton								
obo:T4FS_0000485	reference resolution	data stewardship technical concept	The process of resolving a reference to useful information by using a globally available system.	CASRAI. https://casrai.org/term/reference-resolution	https://orcid.org/0000-0002-7702-4495|Peter McQuilton								
obo:T4FS_0000176	regional standard	data stewardship technical concept	A Regional standard is one that applies across a multi-nation region. Most countries have their own national standards-making bodies, which in turn may also group together to make regional standards. For example, national standards bodies in Europe are also members of the European Committee for Standardization (CEN) as well as members of ISO. The use of such standards may be voluntary, or they may be referenced in regulation (therefore mandatory).	Adapted by AL from ISO. https://www.iso.org/sites/ConsumersStandards/1_standards.html#section1_2	https://orcid.org/0000-0002-7702-4495|Peter McQuilton						AL 9.3.22: Removed reference to CASRAI (https://casrai.org/term/regional-standard/), as the definition was unsuitable.		
obo:T4FS_0000085	registered data	data	Data that have gone through a registration process and have been assigned an identifier metadata to aid in their search and retrieval.	CASRAI. https://casrai.org/term/registered-data	https://orcid.org/0000-0002-7702-4495|Peter McQuilton								
obo:T4FS_0000182	registry	data stewardship technical concept	A database containing information about trusted repositories that are provided by the repository managers and are useful for human and machine users. It is a registry information system on which a register is maintained. These registries do not contain information about all metadata descriptions of digital objects, nor do they offer a list of PIDs of all stored digital objects. They do offer information based on standardized types on how to retrieve such information (e.g., the port under which OAI-PMH can be accessed to offer metadata). It is a set of files containing identifiers assigned to items with descriptions of the associated items. It is assignment of a permanent, unique and unambiguous identifier to an item.	CASRAI. https://casrai.org/term/registry	https://orcid.org/0000-0002-7702-4495|Peter McQuilton								
obo:T4FS_0000032	relational database	data stewardship technical concept	A collection of data items organized as a set of formally-described tables from which data can be accessed or reassembled in many different ways without having to reorganize the database tables. The standard user and application program interface to a relational database is the structured query language (SQL).	CASRAI. https://casrai.org/term/relational-database	https://orcid.org/0000-0002-7702-4495|Peter McQuilton								
obo:T4FS_0000346	relations	data stewardship technical concept	Indicates how the different components within a system are linked to fulfill the tasks. Relations are thus defined by the services they are making use of and by the interface specifications.	CASRAI. https://casrai.org/term/relations	https://orcid.org/0000-0002-7702-4495|Peter McQuilton								
obo:T4FS_0000028	remote access	data stewardship technical concept	The ability to get access to a computer or a network from a remote distance. Access may be through an Internet service provider (ISP) or through a dedicated line between a computer or a remote local area network and the central or main corporate local area network. A dedicated line is more expensive and less flexible but offers faster data rates.	CASRAI. https://casrai.org/term/remote-access	https://orcid.org/0000-0002-7702-4495|Peter McQuilton								
obo:T4FS_0000118	remote data access	data stewardship technical concept	The ability to access and download data from a repository.	CASRAI. https://casrai.org/term/remote-data-access	https://orcid.org/0000-0002-7702-4495|Peter McQuilton								
obo:T4FS_0000489	repository	data stewardship technical concept	Repositories preserve, manage, and provide access to many types of digital materials in a variety of formats.	CASRAI. https://casrai.org/term/repository	https://orcid.org/0000-0002-7702-4495|Peter McQuilton								
obo:T4FS_0000005	repository access	repository	In accessing a repository one uses a client (application) to discover relevant digital objects within a repository, and then retrieve a copy of a desired digital object.	CASRAI. https://casrai.org/term/repository-access	https://orcid.org/0000-0002-7702-4495|Peter McQuilton								
obo:T4FS_0000181	repository certification schemes	repository							Peter McQuilton	2021-02-17T22:10:11.837519Z			
obo:T4FS_0000370	reproducible research	reuse of digital assets	Published results can be replicated using the documented data, code, and methods employed by the author or provider without the need for any additional information or needing to communicate with the author or provider.	CASRAI. https://casrai.org/term/reproducible-research	https://orcid.org/0000-0002-7702-4495|Peter McQuilton								
obo:T4FS_0000449	repurposed data	data	New datasets obtained by combining data appropriately from a variety of existing files, generating new data products that did not previously exist. Repurposed data result from data wrangling.	CASRAI. https://casrai.org/term/repurposed-data/	https://orcid.org/0000-0002-7702-4495|Peter McQuilton								
obo:T4FS_0000518	research data	data	Data that are used as primary sources to support technical or scientific enquiry, research, scholarship, or artistic activity, and that are used as evidence in the research process and/or are commonly accepted in the research community as necessary to validate research findings and results. All other digital and non-digital content have the potential of becoming research data. Research data may be experimental data, observational data, operational data, third party data, public sector data, monitoring data, processed data, or repurposed data.	CASRAI. https://casrai.org/term/research-data	https://orcid.org/0000-0002-7702-4495|Peter McQuilton								
obo:T4FS_0000185	research data format	data stewardship technical concept	Research data format is a generic term encompassing the concept of a standardised format for research data.	AL, 9.3.22	https://orcid.org/0000-0002-7702-4495|Peter McQuilton						AL 9.3.2022: The original CASRAI definition is unsuitable (https://casrai.org/term/research-data-format), therefore I have changed the definition to something more generic.		
obo:T4FS_0000297	research data management	data management	Data Management refers to the storage, access and preservation of data produced from a given investigation. Data management practices cover the entire lifecycle of the data, from planning the investigation to conducting it, and from backing up data as it is created and used to long term preservation of data deliverables after the research investigation has concluded. Specific activities and issues that fall within the category of data management include: File naming (the proper way to name computer files); data quality control and quality assurance; data access; data documentation (including levels of uncertainty); metadata creation and controlled vocabularies; data storage; data archiving and preservation; data sharing and reuse; data integrity; data security; data privacy; data rights; notebook protocols (lab or field).	CASRAI. https://casrai.org/term/research-data-management/	https://orcid.org/0000-0002-7702-4495|Peter McQuilton								
