ID	Label	Definition	Definition Source	Editor	Parent Class	Commenthttp://fairsharing.org/fso/FSO_0011601	Machine readable 	In a form that can be used and understood by a computer.n/ahttp://open.canada.ca/en/open-data-principles#toc94	CASRAI. https://casrai-test.evision.ca/?page_id=324	Peter McQuilton	technical concept	CASRAIhttp://fairsharing.org/fso/FSO_0011602	Machine-readable format	"A broad term encompassing: (a) digital surrogates created as a result of converting analogue materials to digital form (digitisation); (b) born digital for which there has never been and is never intended to be an analogue equivalent; and, (c) digital records. RELATED TERM. Born digital; Digital objects; Digital records; Digital data; Electronic recordsREFERENCE. Open Data &hellip; <a href=CASRAI. https://casrai.org/term/machine-readable-format/ class=more-link"	CASRAI. https://casrai-test.evision.ca/?page_id=325	Peter McQuilton	technical concept	CASRAIhttp://fairsharing.org/fso/FSO_0011603	Mandatory standard	"Requires compliance because of a government statute or regulation, an organization internal policy, or contractual requirement. Failure to comply with a mandatory standard usually carries a sanction, such as civil or criminal penalties, or loss of employment.REFERENCE. American National Standards Institute ANSI Standards Management: A Handbook for Profit"	CASRAI. https://casrai-test.evision.ca/?page_id=330	Peter McQuilton	technical concept	CASRAIhttp://fairsharing.org/fso/FSO_0011604	Metadata	"Literally, data about data; data that defines and describes the characteristics of other data, used to improve both business and technical understanding of data and data-related processes. Business metadata includes the names and business definitions of subject areas, entities and attributes, attribute data types and other attribute properties, range descriptions, valid domain values and their &hellip; <a href=CASRAI. https://casrai.org/term/metadata/ class=more-link"	CASRAI. https://casrai-test.evision.ca/?page_id=337	Peter McQuilton	technical concept	CASRAIhttp://fairsharing.org/fso/FSO_0011605	Metadata catalogue	A catalogue containing metadata records in XML-encoded (machine-readable and human-readable) format that enables services to find data and services.n/ahttp://smw-rda.esc.rzg.mpg.de/index.php/Main_Page	CASRAI. https://casrai-test.evision.ca/?page_id=338	Peter McQuilton	technical concept	CASRAIhttp://fairsharing.org/fso/FSO_0011606	Metadata dataset	The set of metadata describing a specific dataset.n/ahttp://smw-rda.esc.rzg.mpg.de/index.php/Main_Page	CASRAI. https://casrai-test.evision.ca/?page_id=339	Peter McQuilton	technical concept	CASRAIhttp://fairsharing.org/fso/FSO_0011607	Metadata record	"A collection of data defined by a theme, category, which reflects what is being measured, observed, monitored at the various sites. The Metadata Record is an information resource of business value.REFERENCE. Research Data Alliance http://smw-rda.esc.rzg.mpg.de/index.php/Main_Page ; DCC/TC3+"	CASRAI. https://casrai-test.evision.ca/?page_id=340	Peter McQuilton	technical concept	CASRAIhttp://fairsharing.org/fso/FSO_0011608	Middleware	"Computer software that provides services to software applications beyond those available from the operating system. It can be described as software glue. Middleware makes it easier for software developers to perform communication and input/output, so they can focus on the specific purpose of their application.REFERENCE. Research Data Canada Infrastructure Committee; Wikipedia"	CASRAI. https://casrai-test.evision.ca/?page_id=341	Peter McQuilton	technical concept	CASRAIhttp://fairsharing.org/fso/FSO_0011609	Migration	"A means of overcoming technological obsolescence by transferring digital resources from one hardware/software generation to the next. The purpose of migration is to preserve the intellectual content of digital objects and to retain the ability for clients to retrieve, display, and otherwise use them in the face of constantly changing technology. Migration differs from the &hellip; <a href=CASRAI. https://casrai.org/term/migration/ class=more-link"	CASRAI. https://casrai-test.evision.ca/?page_id=342	Peter McQuilton	technical concept	CASRAIhttp://fairsharing.org/fso/FSO_0011610	Minimal metadata	A description with very little curation that would include at least a name and PID of a data object. Minimal metadata is only marginally targeted at discovery since there is much better infrastructure to accomplish this.n/ahttp://smw-rda.esc.rzg.mpg.de/index.php/Main_Page	CASRAI. https://casrai-test.evision.ca/?page_id=343	Peter McQuilton	technical concept	CASRAIhttp://fairsharing.org/fso/FSO_0011611	National standard	"From an official perspective, a national standard is adopted by a national standards body (e.g., Standards Council of Canada, American National Standards Institute, British Standards Institution) and made available to the public. Practically speaking, however, a national standard is any standard that is widely used and recognized within a country. In this context, even government &hellip; <a href=CASRAI. https://casrai.org/term/national-standard/ class=more-link"	CASRAI. https://casrai-test.evision.ca/?page_id=347	Peter McQuilton	technical concept	CASRAIhttp://fairsharing.org/fso/FSO_0011612	Noisy data	"Meaningless data, including: Any data that cannot be understood and interpreted correctly by machines, such as unstructured text; any data that has been received, stored, or changed in such a manner that it cannot be read or used by the program that originally created it. RELATED TERM. Corrupt datan/ahttp://searchbusinessanalytics.techtarget.com/definition/noisy-data"	CASRAI. https://casrai-test.evision.ca/?page_id=349	Peter McQuilton	technical concept	CASRAIhttp://fairsharing.org/fso/FSO_0011613	Non identifiable data	"Data that could not lead to the identification of a specific individual, to distinguishing one person from another, or to personally identifiable information. These may be data that have been de-identified, or that could not lead to personally identifiable information in the first place. RELATED TERM. Non personally identifiable informationn/a"	CASRAI. https://casrai-test.evision.ca/?page_id=350	Peter McQuilton	technical concept	CASRAIhttp://fairsharing.org/fso/FSO_0011614	Non personally identifiable information 	"Data that could not lead to the identification of a specific individual, to distinguishing one person from another, or to personally identifiable information. These may be data that have been de-identified, or that could not lead to personally identifiable information in the first place.n/a"	CASRAI. https://casrai-test.evision.ca/?page_id=351	Peter McQuilton	technical concept	CASRAIhttp://fairsharing.org/fso/FSO_0011615	Normalization 	"The process of organizing data into tables in such a way that the results of using the database are always unambiguous and as intended. Normalization is typically a refinement process after the initial exercise of identifying the data objects that should be in the database, identifying their relationships, and defining the tables required and the &hellip; <a href=CASRAI. https://casrai.org/term/normalization/ class=more-link"	CASRAI. https://casrai-test.evision.ca/?page_id=352	Peter McQuilton	technical concept	CASRAIhttp://fairsharing.org/fso/FSO_0011616	OAI repository 	A type of repository with a network accessible server that can process the 6 OAI-PMH requests in the manner described in the OAI Implementation Guide.n/ahttp://smw-rda.esc.rzg.mpg.de/index.php/Main_Page	CASRAI. https://casrai-test.evision.ca/?page_id=353	Peter McQuilton	technical concept	CASRAIhttp://fairsharing.org/fso/FSO_0011617	Object model 	"A collection of descriptions of classes or interfaces, together with their member data, member functions, and class-static operations.n/ahttp://smw-rda.esc.rzg.mpg.de/index.php/Main_Page"	CASRAI. https://casrai-test.evision.ca/?page_id=355	Peter McQuilton	technical concept	CASRAIhttp://fairsharing.org/fso/FSO_0011618	Open Archives Initiative Protocol for Metadata Harvesting	A low-barrier mechanism for repository interoperability. Data Providers are repositories that expose structured metadata via OAI-PMH. Service Providers then make OAI-PMH service requests to harvest that metadata. OAI-PMH is a set of six verbs or services that are invoked within HTTP. SYNONYM. OAI-PMHREFERENCE. oai.orghttp://www.oai.org	CASRAI. https://casrai-test.evision.ca/?page_id=357	Peter McQuilton	technical concept	CASRAIhttp://fairsharing.org/fso/FSO_0011619	Open data	"Strutured data that are accessible, machine-readable, usable, intelligible, and freely shared. Open data can be freely used, re-used, built on, and redistributed by anyone - subject only, at most, to the requirement to attribute and sharealike.REFERENCE. Research Data Alliance http://smw-rda.esc.rzg.mpg.de/index.php/Main_Page ; Science as an Open Enterprise (SOE)as quoted by TC3+; Open Data 101 (Government of &hellip; <a href=CASRAI. https://casrai.org/term/open-data/ class=more-link"	CASRAI. https://casrai-test.evision.ca/?page_id=358	Peter McQuilton	technical concept	CASRAIhttp://fairsharing.org/fso/FSO_0011620	Open government	"A governing culture that holds that the public has the right to access the documents and proceedings of government to allow for greater openness, accountability, and engagement.n/ahttp://open.canada.ca/en/open-data-principles#toc94"	CASRAI. https://casrai-test.evision.ca/?page_id=359	Peter McQuilton	technical concept	CASRAIhttp://fairsharing.org/fso/FSO_0011621	Original repository	A type of repository where the original copy of data was stored and probably a data identifier registered.n/ahttp://smw-rda.esc.rzg.mpg.de/index.php/Main_Page	CASRAI. https://casrai-test.evision.ca/?page_id=362	Peter McQuilton	technical concept	CASRAIhttp://fairsharing.org/fso/FSO_0011622	Persistent identifier	"A persistent identifier is a long-lasting reference to a digital object that gives information about that object regardless what happens to it. Developed to address link rot, a persistent identifier can be resolved to provide an appropriate representation of an object whether that objects changes its online location or goes offline. SYNONYM. PIDREFERENCE. Research Data &hellip; <a href=CASRAI. https://casrai.org/term/persistent-identifier/ class=more-link"	CASRAI. https://casrai-test.evision.ca/?page_id=370	Peter McQuilton	technical concept	CASRAIhttp://fairsharing.org/fso/FSO_0011623	Persistent uniform resource locator'	"This is a URL. However, instead of pointing directly to the location of an Internet resource, a PURL points to an intermediate resolution service. The PURL resolution service associates the PURL with the actual URL and returns that URL to the client. SYNONYM. PURLREFERENCE. MIT data management and publishing"	CASRAI. https://casrai-test.evision.ca/?page_id=371	Peter McQuilton	technical concept	CASRAIhttp://fairsharing.org/fso/FSO_0011624	Personal information privacy	"The World Wide Web Consortium's Platform for Personal Privacy Project (P3P) offers specific recommendations for practices that will let users define and share personal information with Web sites that they agree to share it with. The P3P incorporates a number of industry proposals, including the Open Profiling Standard (OPS). Using software that adheres to the &hellip; <a href=CASRAI. https://casrai.org/term/personal-information-privacy/ class=more-link"	CASRAI. https://casrai-test.evision.ca/?page_id=372	Peter McQuilton	technical concept	CASRAIhttp://fairsharing.org/fso/FSO_0011625	Personally identifiable information	"1. Data which relate to a living individual who can be identified (a) from those data, or (b) from those data and other information which is in the possession of, or is likely to come into the possession of, the data controller, and includes any expression of opinion about the individual and any indication of &hellip; <a href=CASRAI. https://casrai.org/term/personally-identifiable-information/ class=more-link"	CASRAI. https://casrai-test.evision.ca/?page_id=373	Peter McQuilton	technical concept	CASRAIhttp://fairsharing.org/fso/FSO_0011626	PID attribute	A single data element related to a PID and part of its record content.n/ahttp://smw-rda.esc.rzg.mpg.de/index.php/Main_Page	CASRAI. https://casrai-test.evision.ca/?page_id=363	Peter McQuilton	technical concept	CASRAIhttp://fairsharing.org/fso/FSO_0011627	PID domain	"For a single identifier, the class of entity it refers to. For a PID system, the typical class of entities it is intended to be used for. Examples include: digital objects, physical objects, bodies, actors.n/ahttp://smw-rda.esc.rzg.mpg.de/index.php/Main_Page"	CASRAI. https://casrai-test.evision.ca/?page_id=364	Peter McQuilton	technical concept	CASRAIhttp://fairsharing.org/fso/FSO_0011628	PID record	A type of record (and organization) that stores an instance of an executable/understandable PID. The content of a PID record distinguishes a registered digital or data object from other DOs. A PID record is a type of record that includes property information that characterizes the digital object it is identifying. Important parts of a PID &hellip; <a href=CASRAI. https://casrai.org/term/pid-record/ class=more-link	CASRAI. https://casrai-test.evision.ca/?page_id=365	Peter McQuilton	technical concept	CASRAIhttp://fairsharing.org/fso/FSO_0011629	PID resolution	The process of resolving a PID to a useful state of information about a digital object by using a globally available system.n/ahttp://smw-rda.esc.rzg.mpg.de/index.php/Main_Page	CASRAI. https://casrai-test.evision.ca/?page_id=366	Peter McQuilton	technical concept	CASRAIhttp://fairsharing.org/fso/FSO_0011630	PID service	A service that provides a connection between a PID and its target object.n/ahttp://smw-rda.esc.rzg.mpg.de/index.php/Main_Page	CASRAI. https://casrai-test.evision.ca/?page_id=367	Peter McQuilton	technical concept	CASRAIhttp://fairsharing.org/fso/FSO_0011631	PID system	"Consists of at least one PID resolver, a name schema and a defined mechanism for issuing PIDs that conform to the name schema. Examples include: DOI, Handle System, URN, ARK, PURL, etc.n/ahttp://smw-rda.esc.rzg.mpg.de/index.php/Main_Page"	CASRAI. https://casrai-test.evision.ca/?page_id=368	Peter McQuilton	technical concept	CASRAIhttp://fairsharing.org/fso/FSO_0011632	Pipe separated values 	A file that contains the values in a table as a series of ASCII text lines organized so that each column value is separated by a pipe (n/a	CASRAI. https://casrai-test.evision.ca/?page_id=375	Peter McQuilton	technical concept	CASRAIhttp://fairsharing.org/fso/FSO_0011633	Preprint	Preliminary version of an article that has not undergone review but that may be shared for comment. Preprints may be considered as grey literature. RELATED TERM. Working papern/aCASRAI. https://en.wikipedia.org/wiki/Preprint	CASRAI. https://casrai-test.evision.ca/?page_id=376	Peter McQuilton	technical concept	CASRAIhttp://fairsharing.org/fso/FSO_0011634	Preservation metadata	Documents actions that have been undertaken to preserve a digital resource such as migrations and checks sum calculations. Example: Metadata Encoding and Transmission Standard (METS)REFERENCE. DCC/TC3+	CASRAI. https://casrai-test.evision.ca/?page_id=378	Peter McQuilton	technical concept	CASRAIhttp://fairsharing.org/fso/FSO_0011635	Privacy-preserving data linkage	Data linkage where the resulting product has been de-identified. RELATED TERM. De-identificationn/a	CASRAI. https://casrai-test.evision.ca/?page_id=384	Peter McQuilton	technical concept	CASRAIhttp://fairsharing.org/fso/FSO_0011636	Program	"A group of related projects managed in a coordinated way to obtain benefits and control not available from managing them individually. Programs may include elements of related work (e.g., ongoing operations) outside the scope of the discrete projects in a program.REFERENCE. Project Management Institute (2006) The Standard for Program Management; Cornell Project Management Methodology"	CASRAI. https://casrai-test.evision.ca/?page_id=388	Peter McQuilton	technical concept	CASRAIhttp://fairsharing.org/fso/FSO_0011637	Project lifecycle	"Describes the processes and tasks that must be completed to produce a product or service. Different project lifecycles exist for specific products and services. (For example, the lifecycle followed to build a house is very different from the lifecycle followed to develop a software package.)REFERENCE. Cornell Project Management Methodology"	CASRAI. https://casrai-test.evision.ca/?page_id=392	Peter McQuilton	technical concept	CASRAIhttp://fairsharing.org/fso/FSO_0011638	Project management lifecycle	"Defines how to manage a project. It will always be the same, regardless of the project lifecycle being employed.REFERENCE. Cornell Project Management Methodology"	CASRAI. https://casrai-test.evision.ca/?page_id=393	Peter McQuilton	technical concept	CASRAIhttp://fairsharing.org/fso/FSO_0011639	Provenance	"A type of historical information or metadata about the origin, location or the source of something, or the history of the ownership or location of an object or resource including digital objects. For example, information about the Principal Investigator who recorded the data, and the information concerning its storage, handling, and migration.n/ahttp://smw-rda.esc.rzg.mpg.de/index.php/Main_Page"	CASRAI. https://casrai-test.evision.ca/?page_id=400	Peter McQuilton	technical concept	CASRAIhttp://fairsharing.org/fso/FSO_0011640	Provenance metadata	"Information concerning the creation, attribution, or version history of managed data. Provenance metadata that indicates the relationship between two versions of data objects and is generated whenever a new version of a dataset is created. Examples include: (i) the name of the program that generated the new version, (ii) the commit id of the program &hellip; <a href=CASRAI. https://casrai.org/term/provenance-metadata/ class=more-link"	CASRAI. https://casrai-test.evision.ca/?page_id=401	Peter McQuilton	technical concept	CASRAIhttp://fairsharing.org/fso/FSO_0011641	Quality assurance	The process or set of processes used to measure and assure the quality of a product. SYNONYM. QAn/a	CASRAI. https://casrai-test.evision.ca/?page_id=402	Peter McQuilton	technical concept	CASRAIhttp://fairsharing.org/fso/FSO_0011642	Quality control	The process of meeting products and services to consumer expectations.	CASRAI. https://casrai-test.evision.ca/?page_id=403	Peter McQuilton	technical concept	CASRAIhttp://fairsharing.org/fso/FSO_0011643	Raw data	"Data that have not been processed for meaningful use. Although raw data have the potential to become information, they require selective extraction, organization, and sometimes analysis and formatting for presentation. As a result of processing, raw data sometimes end up in a database, which enables the data to become accessible for further processing and analysis &hellip; <a href=CASRAI. https://casrai.org/term/raw-data/ class=more-link"	CASRAI. https://casrai-test.evision.ca/?page_id=404	Peter McQuilton	technical concept	CASRAIhttp://fairsharing.org/fso/FSO_0011644	Re-use	Use of content outside of its original intention.	CASRAI. https://casrai-test.evision.ca/?page_id=405	Peter McQuilton	technical concept	CASRAIhttp://fairsharing.org/fso/FSO_0011645	Real-time data	"Data that are being received, processed and stored at the time of their occurrence with only small delays. Examples include: stock quotes, manufacturing statistics, Web server loads, data warehouse activity and sensor feeds to data collectors. Real-time data are often used for navigation or tracking. Real-time data are data streams that are typically generated by &hellip; <a href=CASRAI. https://casrai.org/term/real-time-data/ class=more-link"	CASRAI. https://casrai-test.evision.ca/?page_id=406	Peter McQuilton	technical concept	CASRAIhttp://fairsharing.org/fso/FSO_0011646	Record	"1. A collection of data items arranged for processing by a program. Multiple records are contained in a file or dataset. Typically, records can be of fixed-length or be of variable length with the length information contained within the record. 2. A record (sometimes called a row) is a group of fields (sometimes called columns) &hellip; <a href=CASRAI. https://casrai.org/term/record/ class=more-link"	CASRAI. https://casrai-test.evision.ca/?page_id=408	Peter McQuilton	technical concept	CASRAIhttp://fairsharing.org/fso/FSO_0011647	Record provenance information	"Information for a data object that includes: * the person who deposited the data object in the repository, * the source of the data object, * the date when the object was deposited, and * authenticity information needed to link the data object to its original source.n/ahttp://smw-rda.esc.rzg.mpg.de/index.php/Main_Page"	CASRAI. https://casrai-test.evision.ca/?page_id=409	Peter McQuilton	technical concept	CASRAIhttp://fairsharing.org/fso/FSO_0011648	Record standardization	"A process in which files are first parsed (assigned to appropriate fields in a record) and then translated to a common format. For example, if an original record had the client's name and address as Bob Jones, VP Acme. Co., 15 S. Main St, Brooklyn the standardized record might read Bob Jones, Vice President, Acme &hellip; <a href=CASRAI. https://casrai.org/term/record-standardization/ class=more-link"	CASRAI. https://casrai-test.evision.ca/?page_id=410	Peter McQuilton	technical concept	CASRAIhttp://fairsharing.org/fso/FSO_0011649	Reference model	A design covering a class of frameworks with the following characteristics: (1) it can be used to generate more specific models that still belong to the class and (2) it can be used to compare a concrete framework design to identify whether it belongs to the same class.n/ahttp://smw-rda.esc.rzg.mpg.de/index.php/Main_Page	CASRAI. https://casrai-test.evision.ca/?page_id=414	Peter McQuilton	technical concept	CASRAIhttp://fairsharing.org/fso/FSO_0011650	Reference resolution	The process of resolving a reference to useful information by using a globally available system.REFERENCE. Digital preservation coalitionhttp://www.dpconline.org/advice/preservationhandbook/introduction/definitions-and-concepts	CASRAI. https://casrai-test.evision.ca/?page_id=415	Peter McQuilton	technical concept	CASRAIhttp://fairsharing.org/fso/FSO_0011651	Regional standard 	REFERENCE. American National Standards Institute ANSI Standards Management: A Handbook for Profit	CASRAI. https://casrai-test.evision.ca/?page_id=418	Peter McQuilton	technical concept	CASRAIhttp://fairsharing.org/fso/FSO_0011652	Registered data 	Data that have gone through a registration process and have been assigned an identifier metadata to aid in their search and retrieval.n/ahttp://smw-rda.esc.rzg.mpg.de/index.php/Main_Page	CASRAI. https://casrai-test.evision.ca/?page_id=419	Peter McQuilton	technical concept	CASRAIhttp://fairsharing.org/fso/FSO_0011653	Registry	"A database containing information about trusted repositories that are provided by the repository managers and are useful for human and machine users. It is a registry information system on which a register is maintained. These registries do not contain information about all metadata descriptions of digital objects, nor do they offer a list of PIDs &hellip; <a href=CASRAI. https://casrai.org/term/registry/ class=more-link"	CASRAI. https://casrai-test.evision.ca/?page_id=420	Peter McQuilton	technical concept	CASRAIhttp://fairsharing.org/fso/FSO_0011654	Relational database 	A collection of data items organized as a set of formally-described tables from which data can be accessed or reassembled in many different ways without having to reorganize the database tables. The standard user and application program interface to a relational database is the structured query language (SQL). SQL statements are used both for interactive &hellip; <a href=CASRAI. https://casrai.org/term/relational-database/ class=more-link	CASRAI. https://casrai-test.evision.ca/?page_id=422	Peter McQuilton	technical concept	CASRAIhttp://fairsharing.org/fso/FSO_0011655	Relations	Indicates how the different components within a system are linked to fulfill the tasks. Relations are thus defined by the services they are making use of and by the interface specifications.n/ahttp://smw-rda.esc.rzg.mpg.de/index.php/Main_Page	CASRAI. https://casrai-test.evision.ca/?page_id=423	Peter McQuilton	technical concept	CASRAIhttp://fairsharing.org/fso/FSO_0011656	Remote access	The ability to get access to a computer or a network from a remote distance. Access may be through an Internet service provider (ISP) or through a dedicated line between a computer or a remote local area network and the central or main corporate local area network. A dedicated line is more expensive and less &hellip; <a href=CASRAI. https://casrai.org/term/remote-access/ class=more-link	CASRAI. https://casrai-test.evision.ca/?page_id=425	Peter McQuilton	technical concept	CASRAIhttp://fairsharing.org/fso/FSO_0011657	Remote data access	The ability to access and download data from a repository. RELATED TERM. Remote accessn/a	CASRAI. https://casrai-test.evision.ca/?page_id=426	Peter McQuilton	technical concept	CASRAIhttp://fairsharing.org/fso/FSO_0011658	Repeatable process	A set of actions that allow for a more efficient use of limited resources and reduce unwanted variation during the development and implementation of various projects. Repeatable processes allow a project team to make efficient use of project components that have proved to be successful in the past and reduce unnecessary variations that can tie &hellip; <a href=CASRAI. https://casrai.org/term/repeatable-process/ class=more-link	CASRAI. https://casrai-test.evision.ca/?page_id=427	Peter McQuilton	technical concept	CASRAI