ID	Label	Definition	Definition Source	Editor	Parent Class	Commenthttp://fairsharing.org/fso/FSO_0011476	Cloud computing	"A large-scale distributed computing paradigm that is driven by economies of scale, in which a pool of abstracted, virtualized, dynamically- scalable, managed computing power, storage, platforms and services are delivered on demand to external customers over the Internet."	CASRAI. https://casrai.org/term/cloud-computing/	Peter McQuilton	technical concept	CASRAIhttp://fairsharing.org/fso/FSO_0011477	Cloud ecosystem	"An ecosystem that includes not only traditional elements of cloud computing such as software and infrastructure, but also consultants, integrators, partners, third parties and anything in their environments that has a bearing on the other components."	CASRAI. https://casrai.org/term/cloud-ecosystem/	Peter McQuilton	technical concept	CASRAIhttp://fairsharing.org/fso/FSO_0011478	Collection management identification	A type of data provenance that adds metadata to identify data collections.	CASRAI. https://casrai.org/term/collection-management-identification/	Peter McQuilton	technical concept	CASRAIhttp://fairsharing.org/fso/FSO_0011479	Comma separated values	A file that contains the values in a table as a series of ASCII text lines organized so that each column value is separated by a comma from the next column's value and each row starts a new line.	CASRAI. https://casrai.org/term/comma-separated-values/	Peter McQuilton	technical concept	CASRAIhttp://fairsharing.org/fso/FSO_0011480	Commit 	The final step in the successful completion of a previously started database change as part of handling a transaction in a computing system.	CASRAI. https://casrai.org/term/commit/	Peter McQuilton	technical concept	CASRAIhttp://fairsharing.org/fso/FSO_0011481	Compliance	Conformance with a law or regulation.	CASRAI. https://casrai.org/term/compliance/	Peter McQuilton	technical concept	CASRAIhttp://fairsharing.org/fso/FSO_0011482	Component	"An entity with a discrete structure within a system considered at a particular level of analysis (e.g., an assembly or software module). Components may be characterized by the services they offer and the internal structures that are required to offer those services."	CASRAI. https://casrai.org/term/component/	Peter McQuilton	technical concept	CASRAIhttp://fairsharing.org/fso/FSO_0011483	Compute intensive	"Any computer application that requires a lot of computation, such as meteorology programs and other scientific applications."	CASRAI. https://casrai.org/term/compute-intensive/	Peter McQuilton	technical concept	CASRAIhttp://fairsharing.org/fso/FSO_0011484	Computer code	"A series of computer instructions written in some human readable computer language, usually stored in a text file."	CASRAI. https://casrai.org/term/computer-code/	Peter McQuilton	technical concept	CASRAIhttp://fairsharing.org/fso/FSO_0011485	Computer intensive	"Any computing application that requires the resources of a lot of computers, such as grid computing."	CASRAI. https://casrai.org/term/computer-intensive/	Peter McQuilton	technical concept	CASRAIhttp://fairsharing.org/fso/FSO_0011486	Confidential information	"Any information obtained by a person on the understanding that they will not disclose it to others, or obtained in circumstances where it is expected that they will not disclose it."	CASRAI. https://casrai.org/term/confidential-information/	Peter McQuilton	technical concept	CASRAIhttp://fairsharing.org/fso/FSO_0011487	Confidentiality	The duties and practices of people and organizations to ensure that individual's personal information only flows from one entity to another according to legislated or otherwise broadly accepted norms and policies.	CASRAI. https://casrai.org/term/confidentiality/	Peter McQuilton	technical concept	CASRAIhttp://fairsharing.org/fso/FSO_0011488	Conformance	The state of having satisfied the requirements of some specific standard(s) and/or specification(s).	CASRAI. https://casrai.org/term/conformance/	Peter McQuilton	technical concept	CASRAIhttp://fairsharing.org/fso/FSO_0011489	Consensus standard	A standard developed through the cooperation of all parties who have an interest in participating in its development and/or use.	CASRAI. https://casrai.org/term/consensus-standard/	Peter McQuilton	technical concept	CASRAIhttp://fairsharing.org/fso/FSO_0011490	Consumer data	"The information trail customers leave behind as a result of their Internet use. This data, which sometimes comprises personal information, comes from such sources and channels as social media networks, marketing campaigns, customer service requests, call centre communications, online browsing data, mobile applications, purchasing history and preferences, and more."	CASRAI. https://casrai.org/term/consumer-data/	Peter McQuilton	technical concept	CASRAIhttp://fairsharing.org/fso/FSO_0011491	Container	Something able to hold objects. A data repository can hold data objects and collections. In this case the data repository may be considered a type of data container.	CASRAI. https://casrai.org/term/container/	Peter McQuilton	technical concept	CASRAIhttp://fairsharing.org/fso/FSO_0011492	Content information	The set of information that is the original target object that has been registered and is under preservation.	CASRAI. https://casrai.org/term/content-information/	Peter McQuilton	technical concept	CASRAIhttp://fairsharing.org/fso/FSO_0011493	Content replication	"A type of Digital migration where there is no change to the Packaging Information, the Content Information, or the PDI. The bits used to represent these Information Objects are preserved in the transfer to the same or new media instance."	CASRAI. https://casrai.org/term/content-replication/	Peter McQuilton	technical concept	CASRAIhttp://fairsharing.org/fso/FSO_0011494	Controlled vocabulary	"A list of standardized terminology, words, or phrases, used for indexing or content analysis and information retrieval, usually in a defined information domain."	CASRAI. https://casrai.org/term/controlled-vocabulary/	Peter McQuilton	technical concept	CASRAIhttp://fairsharing.org/fso/FSO_0011495	Corpus	"A set of documents that has a scientific meaning. A corpus can be produced by an individual researchers activity (including its archival materials), or from a laboratory research, field campaign or science and culture heritage project, a survey, etc."	CASRAI. https://casrai.org/term/corpus/	Peter McQuilton	technical concept	CASRAIhttp://fairsharing.org/fso/FSO_0011496	Correlation	"A statistical measure that indicates the extent to which two or more variables fluctuate together. Correlation does not imply causation. There may be, for example, an unknown factor that influences both variables similarly."	CASRAI. https://casrai.org/term/correlation/	Peter McQuilton	technical concept	CASRAIhttp://fairsharing.org/fso/FSO_0011497	Corrupt data	"Deterioration of computer data as a result of some external agent such as viruses, hardware or software incompatibility, flaws, or failures, power outages, dust, water, extreme temperatures, etc."	CASRAI. https://casrai.org/term/corrupt-data/	Peter McQuilton	technical concept	CASRAIhttp://fairsharing.org/fso/FSO_0011498	Cross-disciplinary	"Explains aspects of one discipline in terms of another (e.g., the physics of music; the politics of literature)."	CASRAI. https://casrai.org/term/cross-disciplinary/	Peter McQuilton	technical concept	CASRAIhttp://fairsharing.org/fso/FSO_0011499	Curation workflow	A type of workflow that includes active steps to curate data as an aid to on-going management of data through its lifecycle.	CASRAI. https://casrai.org/term/curation-workflow/	Peter McQuilton	technical concept	CASRAIhttp://fairsharing.org/fso/FSO_0011500	Darwin information typing architecture	A document creation and management specification that builds content reuse into the authoring process.	CASRAI. https://casrai.org/term/darwin-information-typing-architecture/	Peter McQuilton	technical concept	CASRAIhttp://fairsharing.org/fso/FSO_0011501	Data	"Facts, measurements, recordings, records, or observations about the world collected by scientists and others, with a minimum of contextual interpretation."	CASRAI. https://casrai.org/term/data/	Peter McQuilton	technical concept	CASRAIhttp://fairsharing.org/fso/FSO_0011502	Data access protocol	A system that allows outsiders to be granted access to databases without overloading the system.	CASRAI. https://casrai.org/term/data-access-protocol/	Peter McQuilton	technical concept	CASRAIhttp://fairsharing.org/fso/FSO_0011503	Data archive	An archival service providing the long-term permanent care and accessibility for digital objects with research value.	CASRAI. https://casrai.org/term/data-archive/	Peter McQuilton	technical concept	CASRAIhttp://fairsharing.org/fso/FSO_0011504	Data availability	"The state when data are in the place needed by the user, at the time the user needs them, and in the form needed by the user."	CASRAI. https://casrai.org/term/data-availability/	Peter McQuilton	technical concept	CASRAIhttp://fairsharing.org/fso/FSO_0011505	Data catalogue	A curated collection of metadata about datasets and their data elements.	CASRAI. https://casrai.org/term/data-catalogue/	Peter McQuilton	technical concept	CASRAIhttp://fairsharing.org/fso/FSO_0011506	Data centre	"A facility providing IT services, such as servers, massive storage, and network connectivity."	CASRAI. https://casrai.org/term/data-centre/	Peter McQuilton	technical concept	CASRAIhttp://fairsharing.org/fso/FSO_0011507	Data completeness	"The degree to which all required measures are known. Values may be designated as missing in order not to have empty cells, or missing values may be replaced with default or interpolated values. In the case of default or interpolated values, these must be flagged as such to distinguish them from actual measurements or observations."	CASRAI. https://casrai.org/term/data-completeness/	Peter McQuilton	technical concept	CASRAIhttp://fairsharing.org/fso/FSO_0011508	Data compliance	"Data compliance consists of the ongoing processes to ensure adherence of data to both enterprise business rules (government department, university, industry, or agency), and to legal, regulatory and accreditation requirements."	CASRAI. https://casrai.org/term/data-compliance/	Peter McQuilton	technical concept	CASRAIhttp://fairsharing.org/fso/FSO_0011509	Data container	"A software stack that is chunking digital objects at a physical layer. Typical containers are file systems, database management systems, content management systems, clouds etc."	CASRAI. https://casrai.org/term/data-container/	Peter McQuilton	technical concept	CASRAIhttp://fairsharing.org/fso/FSO_0011510	Data dictionary	A collection of descriptions of the data objects or items in a data model.	CASRAI. https://casrai.org/term/data-dictionary/	Peter McQuilton	technical concept	CASRAIhttp://fairsharing.org/fso/FSO_0011511	Data element	"A unit of data for which the definition, identification, representation (term used to represent it), and permissible values are specified by means of a set of attributes."	CASRAI. https://casrai.org/term/data-element/	Peter McQuilton	technical concept	CASRAIhttp://fairsharing.org/fso/FSO_0011512	Data entity	"An object, event, or phenomenon about which data are stored in a database and which has intermediate representation in a Data Model."	CASRAI. https://casrai.org/term/data-entity/	Peter McQuilton	technical concept	CASRAIhttp://fairsharing.org/fso/FSO_0011513	Data file format	The layout of a file in terms of how the data within the file are organized. A program that uses the data in a file must be able to recognize and possibly access data within the file.	CASRAI. https://casrai.org/term/data-file-format/	Peter McQuilton	technical concept	CASRAIhttp://fairsharing.org/fso/FSO_0011514	Data identifier	An identifier that uniquely distinguishes one set of data from all others.	CASRAI. https://casrai.org/term/data-identifier/	Peter McQuilton	technical concept	CASRAIhttp://fairsharing.org/fso/FSO_0011515	Data integrity	The assurance that information can only be accessed or modified by those authorized to do so.	CASRAI. https://casrai.org/term/data-integrity/	Peter McQuilton	technical concept	CASRAIhttp://fairsharing.org/fso/FSO_0011516	Data item	A type of data element that expresses a proposition that binds one or more property values to some data entity.	CASRAI. https://casrai.org/term/data-item/	Peter McQuilton	technical concept	CASRAIhttp://fairsharing.org/fso/FSO_0011517	Data lifecycle	"Refers to all the stages in the existence of digital information from creation to destruction. A lifecycle view is used to enable active management of the data objects and resource over time, thus maintaining accessibility and usability."	CASRAI. https://casrai.org/term/data-lifecycle/	Peter McQuilton	technical concept	CASRAIhttp://fairsharing.org/fso/FSO_0011518	Data linkage	"The process of bringing together from two or more different sources, data that relate to the same individual, family, place or event)."	CASRAI. https://casrai.org/term/data-linkage/	Peter McQuilton	technical concept	CASRAIhttp://fairsharing.org/fso/FSO_0011519	Data management infrastructure	An infrastructure used to provide data management and enforce data management policies. A data management infrastructure would include resources such as a data repository and an information catalogue.	CASRAI. https://casrai.org/term/data-management-infrastructure/	Peter McQuilton	technical concept	CASRAIhttp://fairsharing.org/fso/FSO_0011520	Data management plan	A formal statement describing how research data will be managed and documented throughout a research project and the terms regarding the subsequent deposit of the data with a data repository for long-term management and preservation.	CASRAI. https://casrai.org/term/data-management-plan/	Peter McQuilton	technical concept	CASRAIhttp://fairsharing.org/fso/FSO_0011521	Data management policy	"A written document backed by management describing policy and providing guidance to ensure that appropriate standards, consistent guidelines, and common strategies are used, providing linkages to and consistency with other similar systems, and fostering a true network across an organization producing data."	CASRAI. https://casrai.org/term/data-management-policy/	Peter McQuilton	technical concept	CASRAIhttp://fairsharing.org/fso/FSO_0011522	Data mart	A repository of data designed to serve a particular community of knowledge workers. The goal of a data mart is to meet the particular demands of a specific group of users.	CASRAI. https://casrai.org/term/data-mart/	Peter McQuilton	technical concept	CASRAIhttp://fairsharing.org/fso/FSO_0011523	Data model	"A model that specifies the structure or schema of a dataset. The model provides a documented description of the data and thus is an instance of metadata. It is a logical, relational data model showing an organized dataset as a collection of tables with entity, attributes and relations."	CASRAI. https://casrai.org/term/data-model/	Peter McQuilton	technical concept	CASRAIhttp://fairsharing.org/fso/FSO_0011524	Data organization	"Denotes the complexity of measures that are used by a repository to form aggregations of data objects (including collections and metadata) to describe the properties of data objects, to register PIDs, to build the PID records, to link between all components, and to set up the containers (software stack) that are used to store all..."	CASRAI. https://casrai.org/term/data-organization/	Peter McQuilton	technical concept	CASRAIhttp://fairsharing.org/fso/FSO_0011525	Data policy	"An organization's stated data/information management processes designed to assist and protect the organization's data research assets. It is a set of high-level principles that establish a guiding framework for data management. A data policy can be used to address strategic aspects such as data access, relevant legal matters, data stewardship issues and custodial duties, data..."	CASRAI. https://casrai.org/term/data-policy/	Peter McQuilton	technical concept	CASRAIhttp://fairsharing.org/fso/FSO_0011526	Data quality	"The reliability and application efficiency of data. It is a perception or an assessment of dataset's fitness to serve its purpose in a given context. Aspects of data quality include: Accuracy, Completeness, Update status, Relevance, Consistency across data sources, Reliability, Appropriate presentation, Accessibility. Within an organization, acceptable data quality is crucial to operational and transactional..."	CASRAI. https://casrai.org/term/data-quality/	Peter McQuilton	technical concept	CASRAIhttp://fairsharing.org/fso/FSO_0011527	Data reference model	A framework whose primary purpose is to enable information sharing and reuse across the federal government via the standard description and discovery of common data and the promotion of uniform data management practices.n/aCASRAI. https://www.whitehouse.gov/sites/default/files/omb/assets/egov_docs/DRM_2_0_Final.pdf	CASRAI. https://casrai.org/term/data-reference-model/	Peter McQuilton	technical concept	CASRAIhttp://fairsharing.org/fso/FSO_0011528	Data retention policy	"An organization's established protocol for retaining information for operational or regulatory compliance needs. The objectives of a data retention policy are to keep important information for future use or reference, to organize information so it can be searched and accessed at a later date, and to dispose of information that is no longer needed."	CASRAI. https://casrai.org/term/data-retention-policy/	Peter McQuilton	technical concept	CASRAIhttp://fairsharing.org/fso/FSO_0011529	Data standardization	In the context of data analysis and data mining: Where V represents the value of the variable in the original datasets: Transformation of data to have zero mean and unit variance. Techniques used include: (a) Data normalization; (b) z-score scaling; (c) Dividing each value by the range: recalculates each variable as V /(max V - ...	CASRAI. https://casrai.org/term/data-standardization/	Peter McQuilton	technical concept	CASRAIhttp://fairsharing.org/fso/FSO_0011530	Data store	"A repository for persistently storing collections of data, such as a database, a file system or a directory. The data stored can be of any type that can be rendered in digital format and placed in electronic media. Examples include text, image, video files and audio files.n/ahttp://whatis.techtarget.com/definition/data-store"	CASRAI. https://casrai.org/term/data-store/	Peter McQuilton	technical concept	CASRAIhttp://fairsharing.org/fso/FSO_0011531	Data stream	"A sequence of digitally encoded, coherent signals used to send or receive a representation of information content as transmitted.n/ahttp://smw-rda.esc.rzg.mpg.de/index.php/Main_Page"	CASRAI. https://casrai.org/term/data-stream/	Peter McQuilton	technical concept	CASRAIhttp://fairsharing.org/fso/FSO_0011532	Data structure	"A specialized format for organizing and storing data. General data structure types include the array, the file, the record, the table, the tree, and so on. Any data structure is designed to organize data to suit a specific purpose so that it can be accessed and worked with in appropriate ways...."	CASRAI. https://casrai.org/term/data-structure/	Peter McQuilton	technical concept	CASRAIhttp://fairsharing.org/fso/FSO_0011533	Data structure continuum	"The continuum of data structure that includes unstructured data, semi-structured data, and structured data.n/ahttp://whatis.techtarget.com/definition/semi-structured-data"	CASRAI. https://casrai.org/term/data-structure-continuum/	Peter McQuilton	technical concept	CASRAIhttp://fairsharing.org/fso/FSO_0011534	Data table attribute	"1. A field or column in a database table. It is an abbreviation for 'physical data attribute' which is a single data element related to a data object, such as a table in a database. The database schema associates one or more attributes with each database entity (i.e. table). 2. A term for a logical..."	CASRAI. https://casrai.org/term/data-table-attribute/	Peter McQuilton	technical concept	CASRAIhttp://fairsharing.org/fso/FSO_0011535	Data tension	"Human tension and/or stress related to the sharing or release of data resulting from concerns about: (a) unknowns about users, uses, and what users will learn from the data before the data producers themselves learn it; (b) what users will learn from the data; (c) data quality; (d) data traceability (or lack thereof); (e) potential..."	CASRAI. https://casrai.org/term/data-tension/	Peter McQuilton	technical concept	CASRAIhttp://fairsharing.org/fso/FSO_0011536	Data traceability	"Data traceability follows the lifecycle of data to track all access and changes to the data. It helps demonstrate transparency, compliance and adherence to regulations. Data traceability, along with data compliance, can be considered part of a data audit process. Data traceability is fundamental to reproducible research.n/a"	CASRAI. https://casrai.org/term/data-traceability/	Peter McQuilton	technical concept	CASRAIhttp://fairsharing.org/fso/FSO_0011537	Data type registry	"1. A registry that links data types of all sorts with the executable data processing functions that can be useful for working with a specific data type. Examples include: complex file types in biology (diagnosis), registering categories that appear in PID records to describe data properties. Data types range from complex digital objects to simple..."	CASRAI. https://casrai.org/term/data-type-registry/	Peter McQuilton	technical concept	CASRAIhttp://fairsharing.org/fso/FSO_0011538	Data upload database	"A collection of interrelated data often with controlled redundancy, organized according to a scheme to serve one or more applications; the data are stored so that they can be used by several programs without concern for data structures or organization.n/ahttp://smw-rda.esc.rzg.mpg.de/index.php/Main_Page"	CASRAI. https://casrai.org/term/data-upload-database/	Peter McQuilton	technical concept	CASRAIhttp://fairsharing.org/fso/FSO_0011539	Data warehouse	"A central repository for all or significant parts of the data that an organization's various business systems collect. A data warehouse tends to be a strategic but somewhat unfinished concept. Data warehousing emphasizes the capture of data from diverse sources for useful analysis and access, but does not generally start from the point-of-view of the &hellip; <a href=CASRAI. https://casrai.org/term/data-warehouse/ class=more-link"	CASRAI. https://casrai.org/term/data-warehouse/	Peter McQuilton	technical concept	CASRAIhttp://fairsharing.org/fso/FSO_0011540	Database	"A collection of data that is organised in a according to a conceptual structure/model describing the characteristics of these data and the relationships among their corresponding entities, supporting one or more application areas. A database allows its contents to be easily accessed, managed and updated. The type of database used depends on the requirements of &hellip; <a href=CASRAI. https://casrai.org/term/database/ class=more-link"	CASRAI. https://casrai.org/term/database/	Peter McQuilton	technical concept	CASRAIhttp://fairsharing.org/fso/FSO_0011541	Dataset	"Any organized collection of data in a computational format, defined by a theme or category that reflects what is being measured/observed/monitored. The presentation of the data in the application is enabled through metadata.REFERENCE. Research Data Alliance http://smw-rda.esc.rzg.mpg.de/index.php/Main_Page ; Mapping the Data Landscape 2011 Summit; TBS Standard on Geospatial Data (ISO 19115:2003); Environment Canada data stewardship &hellip; <a href=CASRAI. https://casrai.org/term/dataset/ class=more-link"	CASRAI. https://casrai.org/term/dataset/	Peter McQuilton	technical concept	CASRAIhttp://fairsharing.org/fso/FSO_0011542	Dataset series	"A collection of datasets sharing the same product specification. A dataset series is a type of aggregation or collection with some logical grouping such as by a topic (specification) with the (product) unit being a dataset series. Example: A series of earth observations. Each year, month or week (depending on the volume) might be a &hellip; <a href=CASRAI. https://casrai.org/term/dataset-series/ class=more-link"	CASRAI. https://casrai.org/term/dataset-series/	Peter McQuilton	technical concept	CASRAIhttp://fairsharing.org/fso/FSO_0011543	De facto standard	"A standard that is widely accepted and used, but lacks formal approval by a recognized standards developing organization (e.g., the QWERTY keyboard).n/ahttp://www.ses-standards.org/?58"	CASRAI. https://casrai.org/term/de-facto-standard/	Peter McQuilton	technical concept	CASRAIhttp://fairsharing.org/fso/FSO_0011544	Deep archive	"A storage location for data that will probably not be accessed again, but must be kept in case of a compliance audit or some other reason.n/ahttp://searchstorage.techtarget.com/definition/active-archive"	CASRAI. https://casrai.org/term/deep-archive/	Peter McQuilton	technical concept	CASRAIhttp://fairsharing.org/fso/FSO_0011545	Descriptive metadata	"Enables identification, location, and retrieval of information resources by users, often including the use of controlled vocabularies for classification and indexing and links to related resources.REFERENCE. DCC/TC3+"	CASRAI. https://casrai.org/term/descriptive-metadata/	Peter McQuilton	technical concept	CASRAI