ID	Label	Definition	Definition Source	Editor	Parent Class	Commenthttp://fairsharing.org/fso/FSO_0011412	Intellectual leadership	"The capacity to influence stakeholders and the direction of research activities; the ability to shape others' understanding in ways that capture interest, inform and gain support; and, the capacity to influence the actions and opinions of others.REFERENCE. Government of Canada (2006) Model guide for the preparation of researchers' career advancement (promotion) documentation ; Government of &hellip; <a href=CASRAI. https://casrai.org/term/intellectual-leadership/ class=more-link"	CASRAI. https://casrai.org/term/intellectual-leadership/	Peter McQuilton	activity	CASRAIhttp://fairsharing.org/fso/FSO_0011413	Interface testing	Testing conducted to evaluate whether systems or components pass data and control correctly to each other.n/aCASRAI. https://www.ee.oulu.fi/research/ouspg/Glossary#OUSPG_Glossary	CASRAI. https://casrai.org/term/interface-testing/	Peter McQuilton	activity	CASRAIhttp://fairsharing.org/fso/FSO_0011414	Long-term preservation	"Long-term preservation - Continued access to digital materials, or at least to the information contained in them, indefinitely.REFERENCE. Digital preservation coalitionhttp://www.dpconline.org/advice/preservationhandbook/introduction/definitions-and-concepts"	CASRAI. https://casrai-test.evision.ca/?page_id=323	Peter McQuilton	activity	CASRAIhttp://fairsharing.org/fso/FSO_0011415	Manage datasets in a repository	"Implement the policies that govern the arrangement, naming, descriptive metadata, provenance metadata, representation metadata, administrative metadata, access controls, retention, disposition, integrity, and replication of digital objects.n/ahttp://smw-rda.esc.rzg.mpg.de/index.php/Main_Page"	CASRAI. https://casrai-test.evision.ca/?page_id=326	Peter McQuilton	activity	CASRAIhttp://fairsharing.org/fso/FSO_0011416	Manage metadata catalog 	"Implement the policies that govern the choice of metadata schema, reserved vocabularies, metadata organization in tables, and metadata properties (creation date, access control, ownership, etc.).n/ahttp://smw-rda.esc.rzg.mpg.de/index.php/Main_Page"	CASRAI. https://casrai-test.evision.ca/?page_id=327	Peter McQuilton	activity	CASRAIhttp://fairsharing.org/fso/FSO_0011417	Managing research	"In the context of a researcher's activities, Managing research is the processes related to the planning, organizing, setting objectives, controlling and evaluating of RDA activities and their associated human and financial resources. It includes the provision of leadership to, and assessment of, other scientists, engineers, technologists, and/or other staff. Managing research is one of the &hellip; <a href=CASRAI. https://casrai.org/term/managing-research/ class=more-link"	CASRAI. https://casrai-test.evision.ca/?page_id=329	Peter McQuilton	activity	CASRAIhttp://fairsharing.org/fso/FSO_0011418	Medium-term preservation	Medium-term preservation - Continued access to digital materials beyond changes in technology for a defined period of time but not indefinitely.REFERENCE. Digital preservation coalitionhttp://www.dpconline.org/advice/preservationhandbook/introduction/definitions-and-concepts	CASRAI. https://casrai-test.evision.ca/?page_id=334	Peter McQuilton	activity	CASRAIhttp://fairsharing.org/fso/FSO_0011419	Peer review	A process by which a scholarly work (such as a paper or a research proposal) is checked by a group of experts in the same field to make sure it meets the necessary standards before it is published or acceptedREFERENCE. Merriam-Webster dictionary	CASRAI. https://casrai-test.evision.ca/?page_id=369	Peter McQuilton	activity	CASRAIhttp://fairsharing.org/fso/FSO_0011420	Preservation	An activity within archiving in which specific items of data are maintained over time so that they can still be accessed and understood through changes in technology. SYNONYM. ConservationREFERENCE. JISC/TC3+; TBS Information Management Glossary (National Archives of Canada Preservation Policy)	CASRAI. https://casrai-test.evision.ca/?page_id=377	Peter McQuilton	activity	CASRAIhttp://fairsharing.org/fso/FSO_0011421	Privacy governance 	"Monitoring the risk to privacy posed by data requests from researchers, and the practices of data custodians in providing data (information governance) to ensure that confidentiality is protected. Such governance requires specialized knowledge of technology, law, and statistical methods. RELATED TERM. Information governance; Governance and accountability moden/a"	CASRAI. https://casrai-test.evision.ca/?page_id=383	Peter McQuilton	activity	CASRAIhttp://fairsharing.org/fso/FSO_0011422	Program governance	"The process of developing, communicating, implementing, monitoring, and assuring the policies, procedures, organizational structures, and practices associated with a given program.REFERENCE. Project Management Institute (2006) The Standard for Program Management."	CASRAI. https://casrai-test.evision.ca/?page_id=389	Peter McQuilton	activity	CASRAIhttp://fairsharing.org/fso/FSO_0011423	Research data management	"Data Management refers to the storage, access and preservation of data produced from a given investigation. Data management practices cover the entire lifecycle of the data, from planning the investigation to conducting it, and from backing up data as it is created and used to long term preservation of data deliverables after the research investigation &hellip; <a href=CASRAI. https://casrai.org/term/research-data-management/ class=more-link"	CASRAI. https://casrai-test.evision.ca/?page_id=446	Peter McQuilton	activity	CASRAIhttp://fairsharing.org/fso/FSO_0011424	Research data publication workflow	"Activities and processes in a digital environment that lead to the publication of research data, associated metadata and accompanying documentation and software code on the Web. In contrast to interim or final published products, workflows are the means to curate, document, and review, and thus ensure and enhance the value of the published product. Workflows &hellip; <a href=CASRAI. https://casrai.org/term/research-data-publication-workflow/ class=more-link"	CASRAI. https://casrai-test.evision.ca/?page_id=448	Peter McQuilton	activity	CASRAIhttp://fairsharing.org/fso/FSO_0011425	Research governance	"Ensures that the benefits to society of research outweigh any risks, from both an ethical and legal perspective.n/a"	CASRAI. https://casrai-test.evision.ca/?page_id=449	Peter McQuilton	activity	CASRAIhttp://fairsharing.org/fso/FSO_0011426	University teaching	"The application of a comprehensive knowledge of a discipline or disciplines to the development of expertise and the generation of new knowledge through research, and the planning and presentation of courses of study for undergraduates and graduates in universities. RELATED TERM. Researchern/ahttp://www.tbs-sct.gc.ca/cla/def/conc-eng.asp#sh"	CASRAI. https://casrai-test.evision.ca/?page_id=517	Peter McQuilton	activity	CASRAIhttp://fairsharing.org/fso/FSO_0011427	User acceptance testing	A phase of development where the product is tested in the real world by the intended audience. The experiences of the early users are forwarded back to the developers who make final changes before releasing the product. SYNONYM. UATn/ahttp://searchsoftwarequality.techtarget.com/definition/user-acceptance-testing-UAT	CASRAI. https://casrai-test.evision.ca/?page_id=522	Peter McQuilton	activity	CASRAIhttp://fairsharing.org/fso/FSO_0011428	Chief Data Officer	"A corporate officer responsible for enterprise-wide governance and utilization of information as an asset, via data processing, analysis, data mining, information trading and other means."	CASRAI. https://casrai.org/term/chief-data-officer/	Peter McQuilton	Person/Individual	CASRAIhttp://fairsharing.org/fso/FSO_0011429	Chief Digital Officer	"A person who helps an organisation drive growth by converting traditional analog activities to digital ones, and overseas operations in the rapidly changing digital sectors such as mobile applications, social media and related applications, virtual goods, as well as wild web-based information management and marketing."	CASRAI. https://casrai.org/term/chief-digital-officer/	Peter McQuilton	Person/Individual	CASRAIhttp://fairsharing.org/fso/FSO_0011430	Chief Information Officer	The most senior executive in an enterprise responsible for the information technology and computer systems that support enterprise goals.	CASRAI. https://casrai.org/term/chief-information-officer/	Peter McQuilton	Person/Individual	CASRAIhttp://fairsharing.org/fso/FSO_0011431	Chief Technology Officer	"Typically is at the same level as, or reporting directly to the chief information officer, the Chief Technology Officer is primarily concerned with long-term and big picture issues (while still having deep technical knowledge of the relevant field)."	CASRAI. https://casrai.org/term/chief-technology-officer/	Peter McQuilton	Person/Individual	CASRAIhttp://fairsharing.org/fso/FSO_0011432	Data custodian	A data custodian is an IT individual or organization responsible for the IT infrastructure providing and protecting data in conformance with the policies and practices prescribed by data governance.	CASRAI. https://casrai.org/term/data-custodian/	Peter McQuilton	Person/Individual	CASRAIhttp://fairsharing.org/fso/FSO_0011433	Data librarian	"Data experts who have a librarian background. Data librarians often carry out curation and metadata related work. There is much overlap between data librarians, data managers, and data stewards."	CASRAI. https://casrai.org/term/data-librarian/	Peter McQuilton	Person/Individual	CASRAIhttp://fairsharing.org/fso/FSO_0011434	Data steward	"Data stewardship is a shared responsibility between Principal Investigators and data stewards. Principal Investigators are responsible for, and data stewards provide support for: (a) Data collection, data integration, or reuse of existing data; (b) Review of data quality; (c) Description of scientific workflow/process; (d) Provision of standards-compliant metadata; and, (e) Submission of data and data..."	CASRAI. https://casrai.org/term/data-steward/	Peter McQuilton	Person/Individual	CASRAIhttp://fairsharing.org/fso/FSO_0011435	Information management advisor	A person having a broad knowledge of information management disciplines and who provides guidance and support to program and staff functions on all aspects of managing the information resource.n/ahttp://www.tbs-sct.gc.ca/cioscripts/gloss/gloss-alpha_e.asp?SubjectID=128&who=/im-gi/	CASRAI. https://casrai.org/term/information-management-advisor/	Peter McQuilton	Person/Individual	CASRAIhttp://fairsharing.org/fso/FSO_0011436	Information management specialist	A person who is expert in one or more of the information management disciplines that support the effective and efficient management of information.n/ahttp://www.tbs-sct.gc.ca/cioscripts/gloss/gloss-alpha_e.asp?SubjectID=128&who=/im-gi/	CASRAI. https://casrai.org/term/information-management-specialist/	Peter McQuilton	Person/Individual	CASRAIhttp://fairsharing.org/fso/FSO_0011437	Information technology specialist 	"Information systems and technology infrastructure manager, expert, or technician.n/ahttp://www.tbs-sct.gc.ca/cioscripts/gloss/gloss-alpha_e.asp?SubjectID=128&who=/im-gi/"	CASRAI. https://casrai.org/term/information-technology-specialist/	Peter McQuilton	Person/Individual	CASRAIhttp://fairsharing.org/fso/FSO_0011438	Key stakeholder 	"A subset of Stakeholders who, if their support were to be withdrawn, would cause the project to fail.REFERENCE. Cornell Project Management Methodology"	CASRAI. https://casrai-test.evision.ca/?page_id=314	Peter McQuilton	Person/Individual	CASRAIhttp://fairsharing.org/fso/FSO_0011439	Laboratory manager	The person who is responsible for the overall administration and the scientific and technical operation of a laboratory including the supervision of tests and the reporting of results of tests. The laboratory manager is responsible for assuring that the laboratory complies with all laws and regulations and is in conformance with all applicable standards. General &hellip; <a href=CASRAI. https://casrai.org/term/laboratory-manager/ class=more-link	CASRAI. https://casrai-test.evision.ca/?page_id=316	Peter McQuilton	Person/Individual	CASRAIhttp://fairsharing.org/fso/FSO_0011440	Laboratory supervisor	A person who under the general supervision of a laboratory manager supervises laboratory personnel and who may perform tests requiring special scientific skills. SYNONYM. Laboratory technical directorn/ahttp://www.ontario.ca/laws/regulation/900682	CASRAI. https://casrai-test.evision.ca/?page_id=317	Peter McQuilton	Person/Individual	CASRAIhttp://fairsharing.org/fso/FSO_0011441	Laboratory technician	A person who under direct supervision performs laboratory tests which require limited technical skill and responsibilities.n/ahttp://www.oaml.com/prog_role.html	CASRAI. https://casrai-test.evision.ca/?page_id=318	Peter McQuilton	Person/Individual	CASRAIhttp://fairsharing.org/fso/FSO_0011442	Laboratory technologist	A person who under general supervision performs tests which require the exercise of independent judgment.n/ahttp://www.oaml.com/prog_role.html	CASRAI. https://casrai-test.evision.ca/?page_id=319	Peter McQuilton	Person/Individual	CASRAIhttp://fairsharing.org/fso/FSO_0011443	Manager	"Program delivery managers and support function managers, at all levels in an institution who are accountable for the direct delivery and support of programs and services within their domain of business responsibility. SYNONYM. Chief. RELATED TERM. Research manager; Project manager; Principal Investigatorn/ahttp://www.tbs-sct.gc.ca/cioscripts/gloss/gloss-alpha_e.asp?SubjectID=128&who=/im-gi/"	CASRAI. https://casrai-test.evision.ca/?page_id=328	Peter McQuilton	Person/Individual	CASRAIhttp://fairsharing.org/fso/FSO_0011444	Principal Investigator	"The Principal Investigator (P.I.) is a researcher who has a research leadership role and is the point of contact for a project or partnership that applies the scientific method, historical method, or other research methodology for the advancement of knowledge resulting in independent, objective, high quality, traceable, and reproducible results. The P.I. has primary responsibility &hellip; <a href=CASRAI. https://casrai.org/term/principal-investigator/ class=more-link"	CASRAI. https://casrai-test.evision.ca/?page_id=381	Peter McQuilton	Person/Individual	CASRAIhttp://fairsharing.org/fso/FSO_0011445	Program manager	"The person responsible for creating the organizational environment culture by providing clear direction and circumstances that allow people to be successful. The program manager is judged on the elements time, cost, and scope, cumulatively for all the projects and operations within the program. Program management decisions are both tactical and strategic in nature. The strategy &hellip; <a href=CASRAI. https://casrai.org/term/program-manager/ class=more-link"	CASRAI. https://casrai-test.evision.ca/?page_id=390	Peter McQuilton	Person/Individual	CASRAIhttp://fairsharing.org/fso/FSO_0011446	Project manager	"The person who is tasked with delivering a project within the boundaries and framework established by the program manager. The project manager is and should be delivery and execution focused and is judged on the elements of time, cost, and scope of the project. The person responsible for ensuring that the Project Team completes the &hellip; <a href=CASRAI. https://casrai.org/term/project-manager/ class=more-link"	CASRAI. https://casrai-test.evision.ca/?page_id=394	Peter McQuilton	Person/Individual	CASRAIhttp://fairsharing.org/fso/FSO_0011447	Project team member	"Responsible for executing tasks and producing deliverables as outlined in the Project Plan and directed by the Project Manager, at whatever level of effort or participation has been defined for them.REFERENCE. Cornell Project Management Methodology"	CASRAI. https://casrai-test.evision.ca/?page_id=396	Peter McQuilton	Person/Individual	CASRAIhttp://fairsharing.org/fso/FSO_0011448	Research manager	"The person who manages or coordinates resources, personnel, facilities, and operating funds-allocations in an organization conducting research, development and analysis (RDA) in the natural and physical sciences. A research manager determines the nature, priority objectives and the resources committed to their achievement within and across the organizations, and evaluates program outputs in relation to organizational &hellip; <a href=CASRAI. https://casrai.org/term/research-manager/ class=more-link"	CASRAI. https://casrai-test.evision.ca/?page_id=450	Peter McQuilton	Person/Individual	CASRAIhttp://fairsharing.org/fso/FSO_0011449	Research scientist	"A scientist who conducts activities in: (1) Research, development and analysis (RDA); (2) Managing research; and, (3) Representation and client services. SYNONYM. RES. RELATED TERM. Scientist; Research contextn/a"	CASRAI. https://casrai-test.evision.ca/?page_id=453	Peter McQuilton	Person/Individual	CASRAIhttp://fairsharing.org/fso/FSO_0011450	Scientist	A person who is studying or has expert knowledge of one or more of the natural or physical sciences. RELATED TERM. ScienceREFERENCE. Oxford dictionnary	CASRAI. https://casrai-test.evision.ca/?page_id=475	Peter McQuilton	Person/Individual	CASRAIhttp://fairsharing.org/fso/FSO_0011451	Creativity	"The ability to have an innovative approach to research by creating new or modified current concepts, theories, approaches and/or solutions."	CASRAI. https://casrai.org/term/creativity/	Peter McQuilton	Soft Skill	CASRAIhttp://fairsharing.org/fso/FSO_0011452	Operational management	"Ongoing organizational activities associated with supporting functional elements, as opposed to project elements. Operational management also includes support of products that the organization has created through project activity.REFERENCE. Project Management Institute (2006) The Standard for Program Management."	CASRAI. https://casrai-test.evision.ca/?page_id=360	Peter McQuilton	Soft Skill	CASRAIhttp://fairsharing.org/fso/FSO_0011453	Organizational leadership	"Organizational leadership is: (a) The ability to attract, assess, mobilize and focus energies and talent to work towards a shared purpose aligned with the mandate of the organization; (b) The ability to change culture, processes and priorities within the organization; and, (c) The ability to mentor.REFERENCE. Government of Canada (2006) Model guide for the preparation &hellip; <a href=CASRAI. https://casrai.org/term/organizational-leadership/ class=more-link"	CASRAI. https://casrai-test.evision.ca/?page_id=361	Peter McQuilton	Soft Skill	CASRAIhttp://fairsharing.org/fso/FSO_0011455	Access	"The continued, available for use, ongoing usability of a digital resource, retaining all qualities of authenticity, accuracy and functionality deemed to be essential for the purposes the digital material was created and/or acquired for. Users who have access can retrieve, manipulate, copy, and store copies on a wide range of hard drives and external devices."	CASRAI. https://casrai.org/term/access	Peter McQuilton	technical concept	CASRAIhttp://fairsharing.org/fso/FSO_0011456	Access control list	A list used to grant permission matched against credentials.	CASRAI. https://casrai.org/term/access-control-list/	Peter McQuilton	technical concept	CASRAIhttp://fairsharing.org/fso/FSO_0011457	Access controls	"Given a data object name, access controls define access relationships between the following metadata: data object name, a user name (or user group, or user role), and access permission. The information can be stored as metadata information associated with each data object. The information can be generated dynamically by applying the access controls of the collection that organizes the data objects."	CASRAI. https://casrai.org/term/access-controls/	Peter McQuilton	technical concept	CASRAIhttp://fairsharing.org/fso/FSO_0011458	Access workflow	A type of access entity that contains the services and functions which make the data object holdings and their information content and related services visible to data consumers.	CASRAI. https://casrai.org/term/access-workflow/	Peter McQuilton	technical concept	CASRAIhttp://fairsharing.org/fso/FSO_0011459	Accession number	Numbers used by the National Center for Biotechnology Information (NCBI) that are unique and citable.	CASRAI. https://casrai.org/term/accession-number/	Peter McQuilton	technical concept	CASRAIhttp://fairsharing.org/fso/FSO_0011460	Analogue materials	"Non-digital materials that have a physical presence (e.g., written and printed material)."	CASRAI. https://casrai.org/term/analogue-materials/	Peter McQuilton	technical concept	CASRAIhttp://fairsharing.org/fso/FSO_0011461	Analogue signals	Continuous electronic signals.	CASRAI. https://casrai.org/term/analogue-signals/	Peter McQuilton	technical concept	CASRAIhttp://fairsharing.org/fso/FSO_0011462	Analytical quality control	"Processes and procedures designed to ensure that the results of laboratory analysis are consistent, comparable, accurate and within specified limits of precision."	CASRAI. https://casrai.org/term/analytical-quality-control/	Peter McQuilton	technical concept	CASRAIhttp://fairsharing.org/fso/FSO_0011463	Analytics	The discovery of meaningful multidimensional patterns in data.	CASRAI. https://casrai.org/term/analytics/	Peter McQuilton	technical concept	CASRAIhttp://fairsharing.org/fso/FSO_0011464	Anomaly	"A rule, practice, or observation that is different from what is normal or usual."	CASRAI. https://casrai.org/term/anomaly/	Peter McQuilton	technical concept	CASRAIhttp://fairsharing.org/fso/FSO_0011465	Anonymity	"A form of privacy that is not usually needed or wanted. There are occasions, however, when a user may want anonymity (for example, to report a crime). The need is sometimes met through the use of a site, called a remailer that re-posts a message from its own address, thus disguising the originator of the message."	CASRAI. https://casrai.org/term/anonymity/	Peter McQuilton	technical concept	CASRAIhttp://fairsharing.org/fso/FSO_0011466	Application Vulnerability Description Language	An XML definition for exchange of information relating to security vulnerabilities of applications exposed to networks.	CASRAI. https://casrai.org/term/application-vulnerability-description-language/	Peter McQuilton	technical concept	CASRAIhttp://fairsharing.org/fso/FSO_0011467	Archive	"A place or collection containing static records, documents, or other materials for long-term preservation."	CASRAI. https://casrai.org/term/archive/	Peter McQuilton	technical concept	CASRAIhttp://fairsharing.org/fso/FSO_0011468	At-risk data	"Data that are at risk of being lost. At-risk data include data that are not easily accessible, have been dispersed, have been separated from the research output object, are stored on a medium that is obsolete or at risk of deterioration, data that were not recorded in digital form, and digital data that are available but are not useable because they have been detached from supporting data, metadata, and information needed to use and interpret them intelligently."	CASRAI. https://casrai.org/term/at-risk-data/	Peter McQuilton	technical concept	CASRAIhttp://fairsharing.org/fso/FSO_0011469	Authenticity metadata	A type of metadata that conveys information needed to link a data object to its original source.	CASRAI. https://casrai.org/term/authenticity-metadata/	Peter McQuilton	technical concept	CASRAIhttp://fairsharing.org/fso/FSO_0011470	Big data	"An evolving term that describes any voluminous amount of structured, semi-structured and unstructured data that have the potential to be mined for information."	CASRAI. https://casrai.org/term/big-data/	Peter McQuilton	technical concept	CASRAIhttp://fairsharing.org/fso/FSO_0011471	Canonical data collection	"A data collection that has been normalized by some established criteria to allow for effective data management. Examples include: data files that belong to a certain experiment, all files that are created by one specific simulation, all files that belong to a specific observation (same day, same place, etc.)."	CASRAI. https://casrai.org/term/canonical-data-collection/	Peter McQuilton	technical concept	CASRAIhttp://fairsharing.org/fso/FSO_0011472	Catalogue	"A type of collection that describes, and points to features of another collection."	CASRAI. https://casrai.org/term/catalogue/	Peter McQuilton	technical concept	CASRAIhttp://fairsharing.org/fso/FSO_0011473	Change log	"Tracks the progress of each change from submission through review, approval, implementation and closure. The log can be managed manually by using a document or spreadsheet, or it can be managed automatically with a software or Web-based tool."	CASRAI. https://casrai.org/term/change-log/	Peter McQuilton	technical concept	CASRAIhttp://fairsharing.org/fso/FSO_0011474	Checksum	A checksum is a type of metadata and an important property of a data object to allow verifying identity and integrity.	CASRAI. https://casrai.org/term/checksum/	Peter McQuilton	technical concept	CASRAIhttp://fairsharing.org/fso/FSO_0011475	Citable data	A type of referable data that has undergone quality assessment and can be referred to as citations in publications and as part of research objects.	CASRAI. https://casrai.org/term/citable-data/	Peter McQuilton	technical concept	CASRAI